col0,col1,col2,col3,col4,col5,col6,col7,col8,col9,col10,col11,col12,col13,col14,col15,col16,col17,col18,col19,col20,col21,col22,col23,col24,col25,col26,col27,col28,col29,col30,col31
http://opendatacommunities.org/id/district-council/ryedale,Ryedale District Council,Kirbymoorside-01,,"""Old Brickworks (southern part), North of Swineherd Lane, Kirkbymoorside""",https://www.ryedale.gov.uk/images/PDF/planning/Old_Brickworks_North_of_Swineherd_Lane_Kirkbymoorside.pdf,ETRS89,-0.922285,54.27026,0.38,not owned by a public authority,yes,pending decision,,,,,6,"""Proposed erection of 4 no. semi-detached dwellings and 2 no. detached dwellings, the erection of garages and the creation and alterations of vehicular access points""",,,,,,,,2017-12-21,2017-12-21,81 (part),265,470284.733631,486601.328094
http://opendatacommunities.org/id/district-council/ryedale,Ryedale District Council,Kirbymoorside-04,,"""Former Russells (western part), New Road, Kirkbymoorside""",https://www.ryedale.gov.uk/images/PDF/planning/Russells_New_Road_Kirkbymoorside.pdf,ETRS89,-0.929952,54.265857,0.64,not owned by a public authority,yes,permissioned,reserved matters approval,2011-04-21,,,19,"""Site forms part of wider site with permission for erection of 8no. four bedroom dwellings, 16no. three bedroom dwellings, 20no. two bedroom dwellings and 2no. one bedroom dwellings with associated garaging and parking""",,,,,,,,2017-12-21,2017-12-21,550 (part),389 (part),469792.860692,486103.75436
http://opendatacommunities.org/id/district-council/ryedale,Ryedale District Council,Malton-02,,"""Ryedale House, Old Malton Road, Malton""",https://www.ryedale.gov.uk/images/PDF/planning/Ryedale_House_Malton.pdf,ETRS89,-0.789411,54.139191,1.4,owned by a public authority,yes,not permissioned,,,,,42,,,,,,,,,2017-12-21,2017-12-21,92,450,479187.565812,472158.628648
http://opendatacommunities.org/id/district-council/ryedale,Ryedale District Council,Norton-07,,"""Former ATS (Car Workshop), north of Commercial Street, Norton""",https://www.ryedale.gov.uk/images/PDF/planning/ATS_car_workshop_North_of_Commercial_Street_Norton.pdf,ETRS89,-0.786712,54.132817,0.74,not owned by a public authority,,permissioned,full planning permission,2015-08-28,,,22,"""Erection of 37no. one bedroom apartments. 20no. two bedroom apartments, 5no. three bedroom dwellings with undercroft parking, private and communal amenity areas, landscaping, alteration to existing vehicular access and erection of street front commercial unit with one bed studio above""",,,,,,,"""Much of site in Flood Zone 2 or 3 - part of area may be suitable for flatted residential. Landowner indicated that current permissioned scheme is unviable""",2017-12-21,2017-12-21,431,,479376.035424,471452.451826
http://opendatacommunities.org/id/district-council/ryedale,Ryedale District Council,Old_Malton-02,,"""Former Highways depot, Westgate, Old Malton""",https://www.ryedale.gov.uk/images/PDF/planning/Former_Highways_Depot_Westgate_Old_Malton.pdf,ETRS89,-0.780027,54.145702,0.46,owned by a public authority,yes,permissioned,reserved matters approval,2017-01-27,,,14,"""Site forms part of wider site with permission for erection of 24no. four bedroom dwellings, 9no. three bedroom dwellings and 6no. two bedroom dwellings with associated garaging, parking, amenity areas and landscaping to include demolition and some rebuilding of existing site buildings""",,,,,,,,2017-12-21,2017-12-21,512 (part),350 (part),479788.115039,472893.537012
http://opendatacommunities.org/id/district-council/ryedale,Ryedale District Council,Pickering-02,,"""Land South of Outgang Road, North of Crossgates Lane, Pickering""",https://www.ryedale.gov.uk/images/PDF/planning/FC_Site_Land_south_of_Outgang_Lane_North_of_Crossgates_Lane_Pickering.pdf,ETRS89,-0.773682,54.241593,0.48,owned by a public authority,yes,not permissioned,,,,,14,,,,,,,,,2017-12-21,2017-12-21,133,142,480017.492669,483569.625303
