col0,col1,col2,col3,col4,col5,col6,col7,col8,col9,col10,col11,col12,col13,col14,col15,col16,col17,col18,col19,col20,col21,col22,col23,col24,col25,col26,col27,col28,col29,col30,col31,col32,col33,col34,col35,col36,col37,col38,col39,col40,col41,col42,col43,col44,col45,col46,col47,col48,col49,col50,col51,col52,col53,col54,col55,col56,col57,col58,col59,col60,col61,col62,col63,col64,col65,col66,col67,col68,col69,col70,col71,col72,col73,col74,col75,col76,col77,col78,col79,col80,col81,col82,col83,col84,col85,col86
,,Record 1,PHI:3,Uniprot,P26215,EMBL,AAA79885,,,SB111,PGN1,,,,,,,5017,Bipolaris zeicola,,SB111,Leaf spot,Monocots,4577,Zea mays (related: maize),,,,,Endopolygalacturonase,GO:0004650,GO,,unaffected pathogenicity,,no,no,no,,,,,,,pectin,,,,,,Gene disruption,,,MU; JA,2152162,PubMed,10.1105/tpc.2.12.1191,,brittanymiller@hotmail.com,Expression during all infection stages. pathogen formerly called Cochliobolus carbonum teleomorph name,Scott-Craig et al.,1990,,Norma Fisher,PHI-base Vers.3.3,04/05/2005,Rres,,,,,,,,,,,,,,,,,,,
,,Record 2,PHI:7,Uniprot,P22287,EMBL,CAA42824,,,race 5,AVR9,,,,,,,5499,Passalora fulva,,,Leaf mould,Eudicots,4081,Solanum lycopersicum (related: tomato),,,,,Effector protein,,,,effector (plant avirulence determinant),,,,,,,,,,,,,,,,,Gene deletion; gene complementation; biochemical evidence,,,MU,1799694,PubMed,,,nicholasthomas@gmail.com,,Van Kan et al.,1991,,Jorge Sullivan,PHI-base Vers.3.3,04/05/2005,Rres,,,,,,,,,,,,,,,,,,,
,,Record 3,PHI:12,Uniprot,Q01886,EMBL,AAA33023,,,SB111,HTS1,,,,,,,5017,Bipolaris zeicola,,SB111,Leaf spot,Monocots,4577,Zea mays (related: maize),,,,,Cylic Peptide Synthase,"GO:0009405, IMP",GO,,loss of pathogenicity,,,,,,,,,,,,,,,,,Gene disruption,,,TKB; JA,11607305,PubMed,,,william32@watson-alvarado.com,pathogen formerly called Cochliobolus carbonum teleomorph name,Panaccione et al.,1992,,Elizabeth Woods,PHI-base Vers.3.3,04/05/2005,Rres,,,,,,,,,,,,,,,,,,,
,,Record 4,PHI:14,Uniprot,P0C017,EMBL,AAB09711,,,clinical isolate,ADE2,,,,,,,5207,Cryptococcus neoformans,235443.0,H99 (serotype A),Cryptococcosis,Nematodes,6239,Caenorhabditis elegans (related: roundworm),,,,,Phosphoribosylaminoimidazole carboxylase,"GO:0009405, IMP",GO,,reduced virulence,,,,,,,,,,,,,,,,,Gene disruption; gene complementation,,,TKB; KHK,12438649,PubMed,10.1073/pnas.232568599,,emiller@fisher.biz,,Perfect et al.,1993,,Susan Wagner,PHI-base Vers.3.3,04/05/2005,Rres,,,,,,,,,,,,,,,,,,,
,,Record 5,PHI:14,Uniprot,P0C017,EMBL,AAB09711,,,clinical isolate,ADE2,,,,,,,5207,Cryptococcus neoformans,235443.0,H99 (serotype A),Cryptococcosis,Rabbits & hares,9986,Oryctolagus cuniculus (related: rabbit),,,,,Phosphoribosylaminoimidazole carboxylase,"GO:0009405, IMP",GO,,loss of pathogenicity,,,,,,,,,,,,,,,,,Gene disruption; gene complementation,,,TKB; KHK,12438649,PubMed,10.1073/pnas.232568599,,wevans@wright.com,,Perfect et al.,1993,,Peter Montgomery,PHI-base Vers.3.3,04/05/2005,Rres,,,,,,,,,,,,,,,,,,,
,,Record 6,PHI:15,Uniprot,P52751,EMBL,AAA20128,,,Guy-11,MPG1,,,,,,,318829,Magnaporthe oryzae,,Guy11,Rice blast,Monocots,4530,Oryza sativa (related: rice),,,,,Hydrophobin,"GO:0009405, IMP; GO:0051701",GO,,reduced virulence,,Yes,,,,,,,,,,,,,,,Gene deletion,,,MU,8312740,PubMed,10.1105/tpc.5.11.1575,,aortiz@valenzuela.info,,Talbot et al.,1993,,Theodore Mcgrath,PHI-base Vers.3.3,04/05/2005,Rres,,,,,,,,,,,,,,,,,,,
,,Record 7,PHI:17,Uniprot,Q00663,EMBL,CAA43678,,,ATCC750,ACP,,,,,,,5482,Candida tropicalis,5482.0,ATCC 750,Candidiasis,Rodents,10090,Mus musculus (related: house mouse),,,,,Acid proteinase,"GO:0009405, IMP; GO:0004190",GO,,reduced virulence,,,,,,,,,,,,,,,,,Gene disruption; gene complementation,,,TKB,7983570,PubMed,,,laurahill@jacobs.biz,,Togni et al.,1994,,Stephanie Collins,PHI-base Vers.3.3,04/05/2005,Rres,,,,,,,,,,,,,,,,,,,
,,Record 8,PHI:18,Uniprot,Q00363,EMBL,CAA69643,,,Race 5,AVR4,,,,,,,5499,Passalora fulva,,Multiple alleles from numerous strains,Leaf mould,Eudicots,4081,Solanum lycopersicum (related: tomato),,,,,Effector protein,,,,effector (plant avirulence determinant),,,,,,,,,,,,,,,,,Biochemical analysis; gene mutation: characterised; gene complementation,,,TKB,8114941,PubMed,10.1038/367384a0,Nature 1994 Jan 27;367(6461):384-6,preynolds@peterson-mills.com,Expression during biotrophic growth,Joosten et al,1994,,Stephanie Sutton,PHI-base Vers.3.3,04/05/2005,Rres,,,,,,,,,,,,,,,,,,,
,,Record 9,PHI:19,Uniprot,P34809,EMBL,AAA17547,,,L210425,NMT,,,,,,,5207,Cryptococcus neoformans,235443.0,H99,Cryptococcosis,Rabbits & hares,9986,Oryctolagus cuniculus (related: rabbit),,,,,Myristoyl-CoA:protein N-myristoyltransferase,"GO:0009405, IMP; GO:0044412",GO,,reduced virulence,,,,Yes,,,,Heat sensitive,,,,,,,,,Gene mutation: characterised,,,TKB; KHK,7991574,PubMed,,,webbjames@gmail.com,Engineered temperature sensitive allele,Lodge et al.,1994,,Brian Hamilton,PHI-base Vers.3.3,04/05/2005,Rres,,,,,,,,,,,,,,,,,,,
