col0,col1,col2,col3,col4,col5,col6,col7
T0,"Is the galaxy simply smooth and rounded, with no sign of a disk?",![feature_or_disk.png](https://panoptes-uploads.zooniverse.org/production/project_attached_image/f353f2f1-a47e-439d-b9ca-020199162a79.png) Features or Disk,290475,91178981,2018-02-20 10:44:42 UTC,28.3,15715879
T2,Could this be a disk viewed edge-on?,![feature_or_disk.png](https://panoptes-uploads.zooniverse.org/production/project_attached_image/f353f2f1-a47e-439d-b9ca-020199162a79.png) No,290475,91178981,2018-02-20 10:44:42 UTC,28.3,15715879
T4,Is there a bar feature through the centre of the galaxy?,No Bar,290475,91178981,2018-02-20 10:44:42 UTC,28.3,15715879
T5,Is there any sign of a spiral arm pattern?,Yes,290475,91178981,2018-02-20 10:44:42 UTC,28.3,15715879
T6,How tightly wound do the spiral arms appear?,![tight_arms.png](https://panoptes-uploads.zooniverse.org/production/project_attached_image/0726dfdd-72fa-49e8-a112-439294937d5e.png) Tight,290475,91178981,2018-02-20 10:44:42 UTC,28.3,15715879
T7,How many spiral arms are there?,![cant_tell_arms.png](https://panoptes-uploads.zooniverse.org/production/project_attached_image/e40e428f-3e73-4d40-9eff-1616a7399819.png) Cant tell,290475,91178981,2018-02-20 10:44:42 UTC,28.3,15715879
T8,"How prominent is the central bulge, compared with the rest of the galaxy?",![no_bulge.png](https://panoptes-uploads.zooniverse.org/production/project_attached_image/75c872f6-7198-4b15-b663-8b88cb5c4d4b.png) No bulge,290475,91178981,2018-02-20 10:44:42 UTC,28.3,15715879
T11,"Is the galaxy currently merging, or is there any sign of tidal debris?",Neither,290475,91178981,2018-02-20 10:44:42 UTC,28.3,15715879
