col0,col1,col2,col3,col4,col5,col6,col7,col8,col9,col10
7460,CD Moreno Secos,"578 Michael Island
New Thomas, NC 34644",CD Moreno,ruta 25,2007,coordenada,2,system,1,2007-01-23
1002,Rio Cuarto (CB) Supercenter,"60975 Jessica Squares
East Sallybury, FL 71671",Tienda Rio Cuarto (Córdoba) Supercenter,Rio Cuarto Cordoba,2007,coordenada,1,system,1,2007-01-23
1003,San Luis (SL) Supercenter,"8714 Mann Plaza
Lisaside, PA 72227",Tienda San Luis (SL) Supercenter,,2007,coordenada,1,system,1,2007-01-23
1004,San Fernando (PBA) Supercenter,"96593 White View Apt. 094
Jonesberg, FL 05565",Tienda San Fernando (PBA) Supercenter,,2007,coordenada,1,system,1,2007-01-23
1005,San Juan (SJ) Supercenter,"848 Melissa Springs Suite 947
Kellerstad, MD 80819",Tienda San Juan (SJ) Supercenter,,2007,coordenada,1,system,1,2007-01-23
1006,La Rioja (LR) Changomás,"30413 Norton Isle Suite 012
North Lisa, ND 79428",Tienda La Rioja (LR) Changomas,,2007,coordenada,1,system,1,2007-01-23
1023,San Justo (PBA) Supercenter,"39916 Mitchell Crescent
New Andrewburgh, DE 63315",Tienda San Justo Supercenter,,2007,coordenada,1,system,1,2007-01-23
1024,Avellaneda (PBA) Changomas,"086 Mary Cliff
North Deborah, NE 24135",Tienda Avellaneda Changomas,,2007,coordenada,1,system,1,2007-01-23
1025,Caseros (PBA) Changomas,"91634 Strong Mountains Apt. 302
West Alyssa, PA 58475",Tienda Caseros Changomas,,2007,coordenada,1,system,1,2007-01-23
