col0,col1,col2,col3,col4,col5,col6,col7,col8,col9,col10,col11,col12,col13,col14,col15,col16,col17,col18,col19,col20,col21,col22,col23,col24,col25,col26,col27,col28,col29,col30,col31,col32,col33,col34,col35,col36,col37,col38,col39,col40,col41,col42,col43,col44,col45,col46,col47,col48,col49
Caucasian,Female,[50-60),?,Elective,Discharged to home,Physician Referral,1,CP,Surgery-Neuro,35,4,21,0,0,0,723,723.0,719,9,None,None,No,No,No,No,No,No,No,No,No,No,No,No,No,No,No,No,No,No,No,No,No,No,No,No,No,Spinal stenosis in cervical region,Spinal stenosis in cervical region,"Effusion of joint, site unspecified"
Caucasian,Female,[20-30),[50-75),Urgent,Discharged to home,Physician Referral,2,UN,?,8,5,5,0,0,0,664,648.0,285,6,None,None,No,No,No,No,No,No,No,No,No,No,No,No,No,No,No,No,No,No,No,No,No,No,No,No,No,"First-degree perineal laceration, unspecified as to episode of care or not applicable","Diabetes mellitus of mother, complicating pregnancy, childbirth, or the puerperium, unspecified as to episode of care or not applicable",Sideroblastic anemia
Caucasian,Male,[80-90),?,Not Available,Discharged/transferred to home with home health service,,7,MC,Family/GeneralPractice,12,0,21,0,0,1,481,428.0,276,9,>200,None,No,No,No,No,No,No,No,No,No,No,No,No,No,No,No,No,No,Steady,No,No,No,No,No,No,Yes,Pneumococcal pneumonia [Streptococcus pneumoniae pneumonia],"Congestive heart failure, unspecified",Hyperosmolality and/or hypernatremia
AfricanAmerican,Female,[50-60),?,Emergency,Discharged to home,Transfer from another health care facility,4,UN,?,33,1,5,0,0,0,682,41.0,250,3,None,None,No,No,No,No,No,No,No,No,No,No,No,No,No,No,No,No,No,Steady,No,No,No,No,No,No,Yes,Cellulitis and abscess of face,"Streptococcus infection in conditions classified elsewhere and of unspecified site, streptococcus, unspecified","Diabetes mellitus without mention of complication, type II or unspecified type, not stated as uncontrolled"
AfricanAmerican,Female,[50-60),?,Emergency,Discharged to home,Emergency Room,5,?,Psychiatry,31,0,13,0,0,0,296,250.01,298,7,None,None,Steady,No,No,No,No,No,Steady,No,No,No,No,No,No,No,No,No,No,Steady,No,No,No,No,No,Ch,Yes,"Bipolar I disorder, single manic episode, unspecified","Diabetes mellitus without mention of complication, type I [juvenile type], not stated as uncontrolled",Depressive type psychosis
Caucasian,Male,[70-80),?,Elective,Discharged to home,Physician Referral,4,?,Cardiology,29,0,10,0,0,0,428,427.0,414,8,None,None,Steady,No,No,No,No,No,No,No,No,No,No,No,No,No,No,No,No,No,No,No,No,No,No,No,Yes,"Congestive heart failure, unspecified",Paroxysmal supraventricular tachycardia,"Coronary atherosclerosis of unspecified type of vessel, native or graft"
Caucasian,Female,[60-70),?,Elective,Expired,Physician Referral,6,MC,InternalMedicine,46,1,20,0,0,0,434,345.0,584,8,None,None,No,No,No,No,No,No,No,No,No,No,No,No,No,No,No,No,No,Steady,No,No,No,No,No,No,Yes,Cerebral thrombosis without mention of cerebral infarction,"Generalized nonconvulsive epilepsy, without mention of intractable epilepsy",Acute kidney failure
