col0,col1,col2,col3,col4,col5,col6
3,About NFC,2,1,2,https://99designs-blog.imgix.net/blog/wp-content/uploads/2018/06/NFC.jpg,"The first quote you may recognise from Lindon Leader who’s famed designs include FedEx, Disney, and Hawaiian Airlines. The second quote is from Albert Einstein. I chose both these quotes to start this piece for 3 take away words I want you to remember:"
4,Новости,4,1,3,https://bipbap.ru/wp-content/uploads/2017/05/VOLKI-krasivye-i-ochen-umnye-zhivotnye.jpg,"Равным образом рамки и место обучения кадров представляет собой интересный эксперимент проверки системы обучения кадров, соответствует насущным потребностям. Значимость этих проблем настолько очевидна, что сложившаяся структура организации в значительной степени обуславливает создание соответствующий условий активизации. Задача организации, в особенности же укрепление и развитие структуры позволяет выполнять важные задания по разработке существенных финансовых и административных услови"
5,Song of ice and fire,3,2,4,https://kbimages1-a.akamaihd.net/271b14a5-2d8c-4889-b7b7-72e52e644f53/353/569/90/False/a-clash-of-kings-a-song-of-ice-and-fire-book-2-1.jpg,"Sed ut perspiciatis, unde omnis iste natus error sit voluptatem accusantium doloremque laudantium, totam rem aperiam eaque ipsa, quae ab illo inventore veritatis et quasi architecto beatae vitae dicta sunt, explicabo. Nemo enim ipsam voluptatem, quia voluptas sit, aspernatur aut odit aut fugit, sed quia consequuntur magni dolores eos, qui ratione voluptatem sequi nesciunt, neque porro quisquam est, qui dolorem ipsum, quia dolor sit, amet, consectetur, adipisci velit, sed quia non numquam eius modi tempora incidunt, ut labore et dolore magnam aliquam quaerat voluptatem. Ut enim ad minima veniam, quis nostrum exercitationem ullam corporis suscipit laboriosam, nisi ut aliquid ex ea commodi consequatur?"
6,Star wars:Empire strickes back,5,2,5,https://i.etsystatic.com/14403810/r/il/047211/1197150509/il_570xN.1197150509_hg99.jpg,"Lorem ipsum dolor sit amet, consectetur adipiscing elit, sed do eiusmod tempor incididunt ut labore et dolore magna aliqua. Ut enim ad minim veniam, quis nostrud exercitation ullamco laboris nisi ut aliquip ex ea commodo consequat. Duis aute irure dolor in reprehenderit in voluptate velit esse cillum dolore eu fugiat nulla pariatur. Excepteur sint occaecat cupidatat non proident, sunt in culpa qui officia deserunt mollit anim id est laborum."
7,Nature news,4,1,6,https://helpx.adobe.com/content/dam/help/en/stock/how-to/visual-reverse-image-search/jcr_content/main-pars/image/visual-reverse-image-search-v2_intro.jpg,"Noise from shipping, construction, sonar and seismic surveys is ""drowning out"" the healthy ocean soundscape, scientists say."
8,Black Or White,6,1,7,https://www.film.ru/sites/default/files/people/1463555-905629.jpg,"The eighth child of the Jackson family, Jackson made his professional debut in 1964 with his elder brothers Jackie, Tito, Jermaine, and Marlon as a member of the Jackson 5. Jackson began his solo career in 1971 while at Motown Records, and rose to solo stardom with his fifth studio album Off the Wall (1979) during the peak of the disco era"
14,Hello world 1,1,1,1,https://static9.depositphotos.com/1594308/1110/i/600/depositphotos_11107478-stock-photo-fantasy.jpg,Hello wordls 1 Hello wordls 1 Hello wordls 1
15,Hello world 2,2,2,1,http://fotorelax.ru/wp-content/uploads/2016/03/Beautiful-photos-and-pictures-on-various-subjects-01.jpg,Hello wordls 2 Hello wordls 2 Hello wordls 2
16,Hello world 3,1,1,1,https://strana.ua/img/article/2625/70_main.jpeg,Hello wordls 3 Hello wordls 3 Hello wordls 3
