col0,col1,col2,col3,col4,col5,col6,col7,col8,col9,col10,col11,col12,col13,col14
11394449,8324141,espirito santo,2,6,Mandala Espírito Santo,mandala mdf,2015-11-14 19:42:12,"171,89",1200,1,4,244,,Decoração
15534262,6939286,cartao de visita,2,0,Cartão de Visita,cartao visita panfletos tag adesivos copos long drink canecas,2018-04-04 20:55:07,"77,67",8,1,5,124,,Papel e Cia
16153119,9835835,expositor de esmaltes,1,38,Organizador expositor p/ 70 esmaltes,expositor,2018-10-13 20:57:07,"73,920006",2709,1,1,59,,Outros
15877252,8071206,medidas lencol para berco americano,1,6,Jogo de Lençol Berço Estampado,t jogo lencol menino lencol berco,2017-02-27 13:26:03,"118,770004",0,1,1,180,1.0,Bebê
15917108,7200773,adesivo box banheiro,3,38,ADESIVO BOX DE BANHEIRO,adesivo box banheiro,2017-05-09 13:18:38,"191,81",507,1,6,34,,Decoração
4336889,3436479,dia dos pais,1,37,Álbum de figurinhas dia dos pais,albuns figurinhas pai lucas album fotos,2018-07-11 10:41:33,"49,97",208,1,1,1093,,Lembrancinhas
7544556,7118324,arranjo de flores para mesa,1,9,Arranjo de Flores - Orquidias,mini arranjos,2016-04-22 13:34:16,"23,67",207,1,5,276,,Decoração
10869150,5203458,lembrancinha maternidade,5,18,Kit Aromarizador + sacola / Lembrancinha Maternidade,bb lembrancinhas maternidade baby lembranca maternidade bebe conforto lembrancinha maternidade,2017-10-05 00:26:02,"12,71",55,0,33,1178,109.0,Lembrancinhas
13193769,2933585,chaveiro dia dos pais,1,35,chaveiro dia dos pais,dia pais,2018-07-04 12:47:49,"11,42",6,1,23,72,,Lembrancinhas
