Date,Title/Description,Category,Type
06/25/2014,Operating Budget 2011-2012,BMO - Operating Budgets,pdf
01/23/2014,BOE - Jurisdictional Policy It is the policy of our jurisdiction that parcel records are public information.,BOE - Docs,pdf
,Data Availability,BOE - Docs,pdf
,2013 CDBG Construction Application,Com Dev - CD,pdf
,2013 CDBG Public Service Application,Com Dev - CD,pdf
,2013 ESG Application,Com Dev - CD,pdf
,2013 Notice of Open Season,Com Dev - CD,pdf
,Ammendments to Community Development Programs,Com Dev - CD,pdf
,Bidders Conference: Pre/Post Questions and Answers,Com Dev - CD,pdf
,Block Grant Disaster Recovery Qtr Report 3-2013,Com Dev - CD,pdf
,CDBG Disaster Recovery Assistance,Com Dev - CD,pdf
,DRGR Action Plan (English Version),Com Dev - CD,pdf
,DRGR Action Plan (Spanish Version),Com Dev - CD,pdf
,ESG 2012,Com Dev - CD,pdf
,Executive Summary,Com Dev - CD,pdf
,Proposed 2013 CDBG Disaster Recovery Action Plan,Com Dev - CD,pdf
,Proposed 2013 One-Year Action Plan,Com Dev - CD,pdf
,Affidavit of Contractor,Com Dev - WD,pdf
,Jefferson County Workforce Investment Act Board 2012-2013 Meeting Schedule,Com Dev - WD,pdf
,Out of School Youth Program GED and Occupational Skills,Com Dev - WD,pdf
,Out of School Youth Program RFP,Com Dev - WD,pdf
,RFP for Internship Program FY 2013-2014,Com Dev - WD,pdf
,Special Needs RFP,Com Dev - WD,pdf
,Summer Youth Employment Program 2013,Com Dev - WD,pdf
,WIA - Out of School Youth Program Occupational Skills Training,Com Dev - WD,pdf
,WIA - Summer Youth Employment Program,Com Dev - WD,pdf
02/14/2012,"Meeting Agenda - 2nd Revision - February 14, 2012",Commission - Agendas,pdf
12/20/2012,"Meeting Agenda - Amended - December 20, 2012",Commission - Agendas,pdf
04/10/2012,"Meeting Agenda - April 10, 2012",Commission - Agendas,pdf
04/10/2014,"Meeting Agenda - April 10, 2014",Commission - Agendas,pdf
04/11/2013,"Meeting Agenda - April 11, 2013",Commission - Agendas,pdf
04/12/2011,"Meeting Agenda - April 12, 2011",Commission - Agendas,pdf
04/23/2015,"Meeting Agenda - April 23, 2015",Commission - Agendas,pdf
04/24/2012,"Meeting Agenda - April 24, 2012",Commission - Agendas,pdf
04/24/2014,"Meeting Agenda - April 24, 2014",Commission - Agendas,pdf
04/25/2013,"Meeting Agenda - April 25, 2013",Commission - Agendas,pdf
04/26/2011,"Meeting Agenda - April 26, 2011",Commission - Agendas,pdf
04/09/2015,"Meeting Agenda - April 9, 2015",Commission - Agendas,pdf
08/10/2010,"Meeting Agenda - August 10, 2010",Commission - Agendas,pdf
08/14/2012,"Meeting Agenda - August 14, 2012",Commission - Agendas,pdf
08/14/2014,"Meeting Agenda - August 14, 2014",Commission - Agendas,pdf
08/15/2013,"Meeting Agenda - August 15, 2013",Commission - Agendas,pdf
08/17/2010,"Meeting Agenda - August 17, 2010",Commission - Agendas,pdf
08/23/2011,"Meeting Agenda - August 23, 2011",Commission - Agendas,pdf
08/24/2010,"Meeting Agenda - August 24, 2010",Commission - Agendas,pdf
08/28/2012,"Meeting Agenda - August 28, 2012",Commission - Agendas,pdf
08/28/2014,"Meeting Agenda - August 28, 2014",Commission - Agendas,pdf
08/29/2013,"Meeting Agenda - August 29, 2013",Commission - Agendas,pdf
08/03/2010,"Meeting Agenda - August 3, 2010",Commission - Agendas,pdf
08/31/2010,"Meeting Agenda - August 31, 2010",Commission - Agendas,pdf
08/09/2011,"Meeting Agenda - August 9, 2011",Commission - Agendas,pdf
12/10/2012,"Meeting Agenda - December 10, 2012",Commission - Agendas,pdf
12/13/2011,"Meeting Agenda - December 13, 2011",Commission - Agendas,pdf
12/14/2010,"Meeting Agenda - December 14, 2010",Commission - Agendas,pdf
12/18/2014,"Meeting Agenda - December 18, 2014",Commission - Agendas,pdf
12/19/2013,"Meeting Agenda - December 19, 2013",Commission - Agendas,pdf
12/20/2012,"Meeting Agenda - December 20, 2012",Commission - Agendas,pdf
12/22/2011,"Meeting Agenda - December 22, 2011",Commission - Agendas,pdf
12/28/2010,"Meeting Agenda - December 28, 2010",Commission - Agendas,pdf
12/04/2014,"Meeting Agenda - December 4, 2014",Commission - Agendas,pdf
04/24/2012,"Meeting Agenda - Draft - April 24, 2012",Commission - Agendas,pdf
08/14/2012,"Meeting Agenda - Draft - August 14, 2012",Commission - Agendas,pdf
08/28/2012,"Meeting Agenda - Draft - August 28, 2012",Commission - Agendas,pdf
02/28/2012,"Meeting Agenda - Draft - February 28, 2012",Commission - Agendas,pdf
07/17/2012,"Meeting Agenda - Draft - July 17, 2012",Commission - Agendas,pdf
07/31/2012,"Meeting Agenda - Draft - July 31, 2012",Commission - Agendas,pdf
06/12/2012,"Meeting Agenda - Draft - June 12, 2012",Commission - Agendas,pdf
06/26/2012,"Meeting Agenda - Draft - June 26, 2012",Commission - Agendas,pdf
03/13/2012,"Meeting Agenda - Draft - March 13, 2012",Commission - Agendas,pdf
09/11/2012,"Meeting Agenda - Draft - September 11, 2012",Commission - Agendas,pdf
09/25/2012,"Meeting Agenda - Draft - September 25, 2012",Commission - Agendas,pdf
02/14/2012,"Meeting Agenda - February 14, 2012",Commission - Agendas,pdf
02/19/2015,"Meeting Agenda - February 19, 2015",Commission - Agendas,pdf
02/22/2011,"Meeting Agenda - February 22, 2011",Commission - Agendas,pdf
02/26/2014,"Meeting Agenda - February 27, 2014",Commission - Agendas,pdf
02/28/2013,"Meeting Agenda - February 28, 2013",Commission - Agendas,pdf
02/05/2015,"Meeting Agenda - February 5, 2015",Commission - Agendas,pdf
02/08/2011,"Meeting Agenda - February 8, 2011",Commission - Agendas,pdf
04/24/2012,"Meeting Agenda - Final - April 24, 2012",Commission - Agendas,pdf
01/11/2011,"Meeting Agenda - January 11, 2011",Commission - Agendas,pdf
01/17/2013,"Meeting Agenda - January 17, 2013",Commission - Agendas,pdf
01/22/2015,"Meeting Agenda - January 22, 2015",Commission - Agendas,pdf
01/24/2012,"Meeting Agenda - January 24, 2012",Commission - Agendas,pdf
01/25/2011,"Meeting Agenda - January 25, 2011",Commission - Agendas,pdf
01/31/2013,"Meeting Agenda - January 31, 2013",Commission - Agendas,pdf
01/31/2014,"Meeting Agenda - January 31, 2014",Commission - Agendas,pdf
01/08/2015,"Meeting Agenda - January 8, 2015",Commission - Agendas,pdf
01/09/2014,"Meeting Agenda - January 9, 2014",Commission - Agendas,pdf
07/10/2014,"Meeting Agenda - July 10, 2014",Commission - Agendas,pdf
07/11/2013,"Meeting Agenda - July 11, 2013",Commission - Agendas,pdf
07/12/2011,"Meeting Agenda - July 12, 2011",Commission - Agendas,pdf
07/16/2015,"Meeting Agenda - July 16, 2015",Commission - Agendas,pdf
07/17/2012,"Meeting Agenda - July 17, 2012",Commission - Agendas,pdf
07/20/2010,"Meeting Agenda - July 20, 2010",Commission - Agendas,pdf
07/24/2014,"Meeting Agenda - July 24, 2014",Commission - Agendas,pdf
07/25/2013,"Meeting Agenda - July 25, 2013",Commission - Agendas,pdf
07/26/2011,"Meeting Agenda - July 26, 2011",Commission - Agendas,pdf
07/27/2010,"Meeting Agenda - July 27, 2010",Commission - Agendas,pdf
07/31/2012,"Meeting Agenda - July 31, 2012",Commission - Agendas,pdf
07/06/2010,"Meeting Agenda - July 6, 2010",Commission - Agendas,pdf
06/11/2014,"Meeting Agenda - June 11, 2014",Commission - Agendas,pdf
06/12/2012,"Meeting Agenda - June 12, 2012",Commission - Agendas,pdf
06/13/2013,"Meeting Agenda - June 13, 2013",Commission - Agendas,pdf
06/18/2015,"Meeting Agenda - June 18, 2015",Commission - Agendas,pdf
06/22/2010,"Meeting Agenda - June 22, 2010",Commission - Agendas,pdf
06/26/2012,"Meeting Agenda - June 26, 2012",Commission - Agendas,pdf
06/25/2014,"Meeting Agenda - June 26, 2014",Commission - Agendas,pdf
06/27/2013,"Meeting Agenda - June 27, 2013",Commission - Agendas,pdf
06/28/2011,"Meeting Agenda - June 28, 2011",Commission - Agendas,pdf
06/30/2015,"Meeting Agenda - June 30, 2015 - Reconvened Meeting of June 18th",Commission - Agendas,pdf
06/04/2015,"Meeting Agenda - June 4, 2015",Commission - Agendas,pdf
03/13/2012,"Meeting Agenda - March 13, 2012",Commission - Agendas,pdf
03/13/2014,"Meeting Agenda - March 13, 2014",Commission - Agendas,pdf
03/14/2013,"Meeting Agenda - March 14, 2013",Commission - Agendas,pdf
03/19/2015,"Meeting Agenda - March 19, 2015",Commission - Agendas,pdf
03/22/2011,"Meeting Agenda - March 22, 2011",Commission - Agendas,pdf
03/27/2014,"Meeting Agenda - March 27, 2014",Commission - Agendas,pdf
03/28/2013,"Meeting Agenda - March 28, 2013",Commission - Agendas,pdf
03/05/2015,"Meeting Agenda - March 5, 2015",Commission - Agendas,pdf
05/08/2012,"Meeting Agenda - May 08, 2012",Commission - Agendas,pdf
05/10/2011,"Meeting Agenda - May 10, 2011",Commission - Agendas,pdf
05/14/2012,"Meeting Agenda - May 14, 2012",Commission - Agendas,pdf
05/16/2013,"Meeting Agenda - May 16, 2013",Commission - Agendas,pdf
05/21/2015,"Meeting Agenda - May 21, 2015",Commission - Agendas,pdf
05/22/2012,"Meeting Agenda - May 22, 2012",Commission - Agendas,pdf
05/22/2014,"Meeting Agenda - May 22, 2014",Commission - Agendas,pdf
05/24/2011,"Meeting Agenda - May 24, 2011",Commission - Agendas,pdf
05/30/2013,"Meeting Agenda - May 30, 2013",Commission - Agendas,pdf
05/07/2015,"Meeting Agenda - May 7, 2015",Commission - Agendas,pdf
05/08/2014,"Meeting Agenda - May 8, 2014",Commission - Agendas,pdf
05/12/2014,"Meeting Agenda - May 8, 2014 - Reconvene",Commission - Agendas,pdf
11/14/2012,"Meeting Agenda - November 14, 2012",Commission - Agendas,pdf
11/02/2010,"Meeting Agenda - November 2, 2010",Commission - Agendas,pdf
11/20/2014,"Meeting Agenda - November 20, 2014",Commission - Agendas,pdf
11/22/2011,"Meeting Agenda - November 22, 2011",Commission - Agendas,pdf
11/23/2010,"Meeting Agenda - November 23, 2010",Commission - Agendas,pdf
11/27/2012,"Meeting Agenda - November 27, 2012",Commission - Agendas,pdf
11/08/2011,"Meeting Agenda - November 8, 2011",Commission - Agendas,pdf
10/10/2013,"Meeting Agenda - October 10, 2013",Commission - Agendas,pdf
10/11/2011,"Meeting Agenda - October 11, 2011",Commission - Agendas,pdf
10/12/2010,"Meeting Agenda - October 12, 2010",Commission - Agendas,pdf
10/19/2010,"Meeting Agenda - October 19, 2010",Commission - Agendas,pdf
10/23/2012,"Meeting Agenda - October 23, 2012",Commission - Agendas,pdf
10/25/2011,"Meeting Agenda - October 25, 2011",Commission - Agendas,pdf
10/26/2010,"Meeting Agenda - October 26, 2010",Commission - Agendas,pdf
10/29/2014,"Meeting Agenda - October 29, 2014",Commission - Agendas,pdf
10/05/2010,"Meeting Agenda - October 5, 2010",Commission - Agendas,pdf
10/09/2014,"Meeting Agenda - October 9, 2014",Commission - Agendas,pdf
12/22/2011,"Meeting Agenda - Reconvened - December 22, 2011",Commission - Agendas,pdf
03/28/2012,"Meeting Agenda - Reconvened - March 28, 2012",Commission - Agendas,pdf
11/06/2012,"Meeting Agenda - Reconvened - November 6, 2012",Commission - Agendas,pdf
04/10/2012,"Meeting Agenda - Revised - April 10, 2012",Commission - Agendas,pdf
02/14/2012,"Meeting Agenda - Revised - February 14, 2012",Commission - Agendas,pdf
06/14/2011,"Meeting Agenda - Revised - June 14, 2011",Commission - Agendas,pdf
03/27/2012,"Meeting Agenda - Revised - March 27, 2012",Commission - Agendas,pdf
09/13/2011,"Meeting Agenda - Revised - September 13, 2011",Commission - Agendas,pdf
09/11/2012,"Meeting Agenda - September 11, 2012",Commission - Agendas,pdf
09/11/2014,"Meeting Agenda - September 11, 2014",Commission - Agendas,pdf
09/12/2013,"Meeting Agenda - September 12, 2013",Commission - Agendas,pdf
09/13/2011,"Meeting Agenda - September 13, 2011",Commission - Agendas,pdf
09/14/2010,"Meeting Agenda - September 14, 2010",Commission - Agendas,pdf
09/21/2010,"Meeting Agenda - September 21, 2010",Commission - Agendas,pdf
09/25/2012,"Meeting Agenda - September 25, 2012",Commission - Agendas,pdf
09/25/2014,"Meeting Agenda - September 25, 2014",Commission - Agendas,pdf
09/26/2013,"Meeting Agenda - September 26, 2013",Commission - Agendas,pdf
09/27/2011,"Meeting Agenda - September 27, 2011",Commission - Agendas,pdf
09/28/2010,"Meeting Agenda - September 28, 2010",Commission - Agendas,pdf
09/07/2010,"Meeting Agenda - September 7, 2010",Commission - Agendas,pdf
03/08/2011,"Meeting Agenda - Updated - March 8, 2011",Commission - Agendas,pdf
01/23/2014,Commission District Map,Commission - Districts Map,pdf
,Jefferson County Commission Districts Map,Commission - Districts Map,pdf
04/10/2012,"Meeting Minutes - April 10, 2012",Commission - Minutes,pdf
04/10/2014,"Meeting Minutes - April 10, 2014",Commission - Minutes,pdf
04/11/2013,"Meeting Minutes - April 11, 2013",Commission - Minutes,pdf
04/12/2011,"Meeting Minutes - April 12, 2011",Commission - Minutes,pdf
04/23/2015,"Meeting Minutes - April 23, 2015",Commission - Minutes,pdf
04/24/2012,"Meeting Minutes - April 24, 2012",Commission - Minutes,pdf
04/24/2014,"Meeting Minutes - April 24, 2014",Commission - Minutes,pdf
04/25/2013,"Meeting Minutes - April 25, 2013",Commission - Minutes,pdf
04/26/2011,"Meeting Minutes - April 26, 2011",Commission - Minutes,pdf
04/09/2015,"Meeting Minutes - April 9, 2015",Commission - Minutes,pdf
08/10/2010,"Meeting Minutes - August 10, 2010",Commission - Minutes,pdf
08/14/2012,"Meeting Minutes - August 14, 2012",Commission - Minutes,pdf
08/14/2014,"Meeting Minutes - August 14, 2014",Commission - Minutes,pdf
08/15/2013,"Meeting Minutes - August 15, 2013",Commission - Minutes,pdf
08/17/2010,"Meeting Minutes - August 17, 2010",Commission - Minutes,pdf
08/23/2011,"Meeting Minutes - August 23, 2011",Commission - Minutes,pdf
08/24/2010,"Meeting Minutes - August 24, 2010",Commission - Minutes,pdf
08/28/2014,"Meeting Minutes - August 28, 2014",Commission - Minutes,pdf
08/28/2012,"Meeting Minutes - August 28,2012",Commission - Minutes,pdf
08/29/2013,"Meeting Minutes - August 29, 2013",Commission - Minutes,pdf
08/03/2010,"Meeting Minutes - August 3, 2010",Commission - Minutes,pdf
08/30/2011,"Meeting Minutes - August 30, 2011",Commission - Minutes,pdf
08/31/2010,"Meeting Minutes - August 31, 2010",Commission - Minutes,pdf
08/04/2011,"Meeting Minutes - August 4, 2011",Commission - Minutes,pdf
12/10/2012,"Meeting Minutes - December 10, 2012",Commission - Minutes,pdf
12/13/2011,"Meeting Minutes - December 13, 2011",Commission - Minutes,pdf
12/14/2010,"Meeting Minutes - December 14, 2010",Commission - Minutes,pdf
12/18/2014,"Meeting Minutes - December 18, 2014",Commission - Minutes,pdf
12/19/2013,"Meeting Minutes - December 19, 2013",Commission - Minutes,pdf
12/20/2012,"Meeting Minutes - December 20, 2012",Commission - Minutes,pdf
12/28/2010,"Meeting Minutes - December 28, 2010",Commission - Minutes,pdf
12/04/2013,"Meeting Minutes - December 4, 2013",Commission - Minutes,pdf
12/04/2014,"Meeting Minutes - December 4, 2014",Commission - Minutes,pdf
02/13/2014,"Meeting Minutes - February 13, 2014",Commission - Minutes,pdf
02/14/2012,"Meeting Minutes - February 14, 2012",Commission - Minutes,pdf
02/14/2013,"Meeting Minutes - February 14, 2013",Commission - Minutes,pdf
02/19/2015,"Meeting Minutes - February 19, 2015",Commission - Minutes,pdf
02/22/2011,"Meeting Minutes - February 22, 2011",Commission - Minutes,pdf
02/27/2014,"Meeting Minutes - February 27, 2014",Commission - Minutes,pdf
02/28/2012,"Meeting Minutes - February 28, 2012",Commission - Minutes,pdf
02/28/2013,"Meeting Minutes - February 28, 2013",Commission - Minutes,pdf
02/05/2015,"Meeting Minutes - February 5, 2015",Commission - Minutes,pdf
02/08/2011,"Meeting Minutes - February 8, 2011",Commission - Minutes,pdf
01/10/2012,"Meeting Minutes - January 10, 2012",Commission - Minutes,pdf
01/11/2011,"Meeting Minutes - January 11, 2011",Commission - Minutes,pdf
01/17/2013,"Meeting Minutes - January 17, 2013",Commission - Minutes,pdf
01/22/2015,"Meeting Minutes - January 22, 2015",Commission - Minutes,pdf
01/24/2012,"Meeting Minutes - January 24, 2012",Commission - Minutes,pdf
01/25/2011,"Meeting Minutes - January 25, 2011",Commission - Minutes,pdf
01/31/2013,"Meeting Minutes - January 31, 2013",Commission - Minutes,pdf
01/31/2014,"Meeting Minutes - January 31, 2014",Commission - Minutes,pdf
01/08/2015,"Meeting Minutes - January 8, 2015",Commission - Minutes,pdf
01/09/2014,"Meeting Minutes - January 9, 2014",Commission - Minutes,pdf
07/10/2014,"Meeting Minutes - July 10, 2014",Commission - Minutes,pdf
07/11/2013,"Meeting Minutes - July 11, 2013",Commission - Minutes,pdf
07/12/2011,"Meeting Minutes - July 12, 2011",Commission - Minutes,pdf
07/17/2012,"Meeting Minutes - July 17, 2012",Commission - Minutes,pdf
07/20/2010,"Meeting Minutes - July 20, 2010",Commission - Minutes,pdf
07/21/2011,"Meeting Minutes - July 21, 2011",Commission - Minutes,pdf
07/24/2014,"Meeting Minutes - July 24, 2014",Commission - Minutes,pdf
07/25/2013,"Meeting Minutes - July 25, 2013",Commission - Minutes,pdf
07/26/2011,"Meeting Minutes - July 26, 2011",Commission - Minutes,pdf
07/27/2010,"Meeting Minutes - July 27, 2010",Commission - Minutes,pdf
07/31/2012,"Meeting Minutes - July 31, 2012",Commission - Minutes,pdf
07/06/2010,"Meeting Minutes - July 6, 2010",Commission - Minutes,pdf
06/11/2014,"Meeting Minutes - June 11, 2014",Commission - Minutes,pdf
06/12/2012,"Meeting Minutes - June 12, 2012",Commission - Minutes,pdf
06/13/2013,"Meeting Minutes - June 13, 2013",Commission - Minutes,pdf
06/14/2011,"Meeting Minutes - June 14, 2011",Commission - Minutes,pdf
06/15/2010,"Meeting Minutes - June 15, 2010",Commission - Minutes,pdf
06/18/2015,"Meeting Minutes - June 18, 2015",Commission - Minutes,pdf
06/22/2010,"Meeting Minutes - June 22, 2010",Commission - Minutes,pdf
06/26/2012,"Meeting Minutes - June 26, 2012",Commission - Minutes,pdf
06/26/2014,"Meeting Minutes - June 26, 2014",Commission - Minutes,pdf
06/27/2013,"Meeting Minutes - June 27, 2013",Commission - Minutes,pdf
06/28/2011,"Meeting Minutes - June 28, 2011",Commission - Minutes,pdf
06/04/2015,"Meeting Minutes - June 4, 2015",Commission - Minutes,pdf
03/13/2012,"Meeting Minutes - March 13, 2012",Commission - Minutes,pdf
03/13/2014,"Meeting Minutes - March 13, 2014",Commission - Minutes,pdf
03/14/2013,"Meeting Minutes - March 14, 2013",Commission - Minutes,pdf
03/19/2015,"Meeting Minutes - March 19,2015",Commission - Minutes,pdf
03/22/2011,"Meeting Minutes - March 22, 2011",Commission - Minutes,pdf
03/27/2014,"Meeting Minutes - March 27, 2014",Commission - Minutes,pdf
03/28/2013,"Meeting Minutes - March 28, 2013",Commission - Minutes,pdf
03/05/2015,"Meeting Minutes - March 5, 2015",Commission - Minutes,pdf
03/08/2011,"Meeting Minutes - March 8, 2011",Commission - Minutes,pdf
05/10/2011,"Meeting Minutes - May 10, 2011",Commission - Minutes,pdf
05/14/2012,"Meeting Minutes - May 14, 2012",Commission - Minutes,pdf
05/16/2013,"Meeting Minutes - May 16, 2013",Commission - Minutes,pdf
05/21/2015,"Meeting Minutes - May 21, 2015",Commission - Minutes,pdf
05/22/2012,"Meeting Minutes - May 22, 2012",Commission - Minutes,pdf
05/22/2014,"Meeting Minutes - May 22, 2014",Commission - Minutes,pdf
05/24/2011,"Meeting Minutes - May 24, 2011",Commission - Minutes,pdf
05/30/2013,"Meeting Minutes - May 30, 2013",Commission - Minutes,pdf
05/07/2015,"Meeting Minutes - May 7, 2015",Commission - Minutes,pdf
05/08/2014,"Meeting Minutes - May 8, 2014",Commission - Minutes,pdf
11/10/2010,"Meeting Minutes - November 10, 2010",Commission - Minutes,pdf
11/12/2014,"Meeting Minutes - November 12, 2014",Commission - Minutes,pdf
11/14/2012,"Meeting Minutes - November 14, 2012",Commission - Minutes,pdf
11/02/2010,"Meeting Minutes - November 2, 2010",Commission - Minutes,pdf
11/20/2014,"Meeting Minutes - November 20, 2014",Commission - Minutes,pdf
11/22/2011,"Meeting Minutes - November 22, 2011",Commission - Minutes,pdf
11/23/2010,"Meeting Minutes - November 23, 2010",Commission - Minutes,pdf
11/26/2013,"Meeting Minutes - November 26, 2013",Commission - Minutes,pdf
11/27/2012,"Meeting Minutes - November 27, 2012",Commission - Minutes,pdf
11/06/2013,"Meeting Minutes - November 6, 2013",Commission - Minutes,pdf
11/08/2011,"Meeting Minutes - November 8, 2011",Commission - Minutes,pdf
10/09/2012,"Meeting Minutes - October 09, 2012",Commission - Minutes,pdf
10/10/2013,"Meeting Minutes - October 10, 2013",Commission - Minutes,pdf
10/12/2010,"Meeting Minutes - October 12, 2010",Commission - Minutes,pdf
10/19/2010,"Meeting Minutes - October 19, 2010",Commission - Minutes,pdf
10/21/2013,"Meeting Minutes - October 21, 2013",Commission - Minutes,pdf
10/23/2012,"Meeting Minutes - October 23, 2012",Commission - Minutes,pdf
10/26/2010,"Meeting Minutes - October 26, 2010",Commission - Minutes,pdf
10/29/2014,"Meeting Minutes - October 29, 2014",Commission - Minutes,pdf
10/05/2010,"Meeting Minutes - October 5, 2010",Commission - Minutes,pdf
10/09/2014,"Meeting Minutes - October 9, 2014",Commission - Minutes,pdf
09/11/2012,"Meeting Minutes - September 11, 2012",Commission - Minutes,pdf
09/12/2013,"Meeting Minutes - September 12, 2013",Commission - Minutes,pdf
09/13/2011,"Meeting Minutes - September 13, 2011",Commission - Minutes,pdf
09/14/2010,"Meeting Minutes - September 14, 2010",Commission - Minutes,pdf
09/21/2010,"Meeting Minutes - September 21, 2010",Commission - Minutes,pdf
09/25/2012,"Meeting Minutes - September 25, 2012",Commission - Minutes,pdf
09/25/2014,"Meeting Minutes - September 25, 2014",Commission - Minutes,pdf
09/26/2013,"Meeting Minutes - September 26, 2013",Commission - Minutes,pdf
09/27/2011,"Meeting Minutes - September 27, 2011",Commission - Minutes,pdf
09/28/2010,"Meeting Minutes - September 28, 2010",Commission - Minutes,pdf
09/07/2010,"Meeting Minutes - September 7, 2010",Commission - Minutes,pdf
04/28/2011,"Meeting Minutes - Special Session - April 28, 2011",Commission - Minutes,pdf
05/04/2011,"Meeting Minutes - Special Session - May 4, 2011",Commission - Minutes,pdf
09/11/2014,"Meeting Minutes- September 11, 2014",Commission - Minutes,pdf
11/18/2014,"2014-11-18 Administrative, Public Works and Infrastructure Agenda",Committees - Administrative Public Works and Infrastructure,pdf
12/02/2014,"2014-12-02 Administrative, Public Works and Infrastructure Agenda",Committees - Administrative Public Works and Infrastructure,pdf
12/16/2014,"2014-12-16 Administrative, Public Works and Infrastructure Agenda",Committees - Administrative Public Works and Infrastructure,pdf
01/06/2015,"2015-01-06 Administrative, Public Works and Infrastructure Agenda",Committees - Administrative Public Works and Infrastructure,pdf
12/06/2011,2011-12-06 Administrative Services Agenda,Committees - Administrative Services,pdf
12/20/2011,2011-12-20 Administrative Services Agenda,Committees - Administrative Services,pdf
01/18/2012,2012-01-18 Administrative Services Agenda,Committees - Administrative Services,pdf
02/07/2012,2012-02-07 Administrative Services Agenda,Committees - Administrative Services,pdf
02/22/2012,2012-02-22 Administrative Services Agenda,Committees - Administrative Services,pdf
03/06/2012,2012-03-06 Administrative Services Agenda,Committees - Administrative Services,pdf
03/20/2012,2012-03-20 Administrative Services Agenda,Committees - Administrative Services,pdf
04/03/2012,2012-04-03 Administrative Services Agenda,Committees - Administrative Services,pdf
04/17/2012,2012-04-17 Administrative Services Agenda,Committees - Administrative Services,pdf
05/04/2012,2012-05-04 Administrative Services Agenda,Committees - Administrative Services,pdf
05/17/2012,2012-05-17 Administrative Services Agenda,Committees - Administrative Services,pdf
06/05/2012,2012-06-05 Administrative Services Agenda,Committees - Administrative Services,pdf
06/19/2012,2012-06-19 Administrative Services Agenda,Committees - Administrative Services,pdf
07/10/2012,2012-07-10 Administrative Services Agenda,Committees - Administrative Services,pdf
07/24/2012,2012-07-24 Administrative Services Agenda,Committees - Administrative Services,pdf
08/07/2012,2012-08-07 Administrative Services Agenda,Committees - Administrative Services,pdf
08/21/2012,2012-08-21 Administrative Services Agenda,Committees - Administrative Services,pdf
08/27/2012,2012-08-27 Administrative Services Agenda,Committees - Administrative Services,pdf
09/05/2012,2012-09-05 Administrative Services Agenda,Committees - Administrative Services,pdf
09/18/2012,2012-09-18 Administrative Services Agenda,Committees - Administrative Services,pdf
10/02/2012,2012-10-02 Administrative Services Agenda - Draft,Committees - Administrative Services,pdf
10/16/2012,2012-10-16 Administrative Services Agenda,Committees - Administrative Services,pdf
11/21/2012,2012-11-21 Administrative Services Agenda,Committees - Administrative Services,pdf
12/05/2012,2012-12-05 Administrative Services Agenda,Committees - Administrative Services,pdf
12/10/2012,2012-12-10 Administrative Services Agenda,Committees - Administrative Services,pdf
12/18/2012,2012-12-18 Administrative Services Agenda,Committees - Administrative Services,pdf
01/15/2013,2013-01-15 Administrative Services Agenda,Committees - Administrative Services,pdf
01/30/2013,2013-01-30 Administrative Services Agenda,Committees - Administrative Services,pdf
02/12/2013,2013-02-12 Administrative Services Agenda,Committees - Administrative Services,pdf
02/26/2013,2013-02-26 Administrative Services Agenda,Committees - Administrative Services,pdf
03/11/2013,2013-03-11 Administrative Services Agenda,Committees - Administrative Services,pdf
03/26/2013,2013-03-26 Administrative Services Agenda,Committees - Administrative Services,pdf
04/09/2013,2013-04-09 Administrative Services Agenda,Committees - Administrative Services,pdf
04/23/2013,2013-04-23 Administrative Services Agenda,Committees - Administrative Services,pdf
05/14/2013,2013-05-14 Adminstrative Services Agenda,Committees - Administrative Services,pdf
05/29/2013,2013-05-29 Administrative Services Agenda,Committees - Administrative Services,pdf
06/11/2013,2013-06-11 Administrative Services Agenda,Committees - Administrative Services,pdf
06/25/2013,2013-06-25 Administrative Services Agenda,Committees - Administrative Services,pdf
07/09/2013,2013-07-09 Administrative Services Agenda,Committees - Administrative Services,pdf
08/13/2013,2013-08-13 Administrative Services Agenda,Committees - Administrative Services,pdf
08/27/2013,2013-08-27 Administrative Services Agenda,Committees - Administrative Services,pdf
09/10/2013,2013-09-10 Administrative Services Agenda,Committees - Administrative Services,pdf
09/17/2013,2013-09-17 Administrative Services Agenda,Committees - Administrative Services,pdf
09/24/2013,2013-09-24 Administrative Services Agenda,Committees - Administrative Services,pdf
10/08/2013,2013-10-08 Administrative Services Agenda,Committees - Administrative Services,pdf
10/21/2013,2013-10-21 Administrative Services Agenda,Committees - Administrative Services,pdf
11/06/2013,2013-11-06 Administrative Services Agenda,Committees - Administrative Services,pdf
12/04/2013,2013-12-04 Administrative Services Agenda,Committees - Administrative Services,pdf
12/17/2013,2013-12-17 Administrative Services Agenda,Committees - Administrative Services,pdf
10/07/2014,2014/10/07 Administrative Services Agenda,Committees - Administrative Services,pdf
01/30/2014,2014-01-07 Administrative Services Agenda,Committees - Administrative Services,pdf
01/28/2014,2014-01-28 Administrative Services Agenda,Committees - Administrative Services,pdf
02/24/2014,2014-02-25 Administrative Services Agenda,Committees - Administrative Services,pdf
03/07/2014,2014-03-11 Administrative Services Agenda,Committees - Administrative Services,pdf
03/25/2014,2014-03-25 Administrative Services Agenda,Committees - Administrative Services,pdf
04/08/2014,2014-04-08 Administrative Services Agenda,Committees - Administrative Services,pdf
04/22/2014,2014-04-22 Administrative Services Agenda,Committees - Administrative Services,pdf
05/06/2014,2014-05-06 Administrative Services Agenda,Committees - Administrative Services,pdf
06/10/2014,2014-06-10 Administrative Services Agenda,Committees - Administrative Services,pdf
06/25/2014,2014-06-25 Administrative Services Agenda,Committees - Administrative Services,pdf
07/08/2014,2014-07-08 Administrative Services Agenda,Committees - Administrative Services,pdf
07/22/2014,2014-07-22 Administrative Services Agenda,Committees - Administrative Services,pdf
08/12/2014,2014-08-12 Administrative Services Agenda,Committees - Administrative Services,pdf
08/26/2014,2014-08-26 Administrative Services Agenda,Committees - Administrative Services,pdf
09/09/2014,2014-09-09 Administrative Services Agenda,Committees - Administrative Services,pdf
09/23/2014,2014-09-23 Administrative Services Agenda,Committees - Administrative Services,pdf
10/07/2014,2014-10-07 Administrative Services Agenda,Committees - Administrative Services,pdf
10/28/2014,2014-10-28 Administrative Services Agenda,Committees - Administrative Services,pdf
04/21/2015,"Committee Agenda - April 21, 2015",Committees - Agendas,pdf
04/07/2015,"Committee Agenda - April 7, 2015",Committees - Agendas,pdf
02/17/2015,"Committee Agenda - February 17, 2015",Committees - Agendas,pdf
01/21/2015,"Committee Agenda - January 21, 2015",Committees - Agendas,pdf
01/06/2015,"Committee Agenda - January 6, 2015",Committees - Agendas,pdf
03/17/2015,"Committee Agenda - March 17, 2015",Committees - Agendas,pdf
03/03/2015,"Committee Agenda - March 3, 2015",Committees - Agendas,pdf
10/16/2012,2012-10-16 Committee Meeting Agenda - Addendum,Committees - Committee Meeting - Addendums,pdf
01/30/2013,2013-01-30 Committee Meeting Agenda - Addendum,Committees - Committee Meeting - Addendums,pdf
02/26/2013,2013-02-26 Committee Meeting Agenda - Addendum,Committees - Committee Meeting - Addendums,pdf
03/26/2013,2013-03-26 Committee Meeting Agenda - Addendum,Committees - Committee Meeting - Addendums,pdf
04/09/2013,2013-04-09 Committee Meeting Agenda - Addendum,Committees - Committee Meeting - Addendums,pdf
06/11/2013,2013-06-11 Committee Meeting Agenda - Addendum,Committees - Committee Meeting - Addendums,pdf
07/23/2013,2013-07-23 Committee Meeting Agenda - Addendum,Committees - Committee Meeting - Addendums,pdf
08/13/2013,2013-08-13 Committee Meeting Agenda - Addendum,Committees - Committee Meeting - Addendums,pdf
03/11/2014,2014-03-11 Committee Meeting Agenda - Addendum,Committees - Committee Meeting - Addendums,pdf
04/08/2014,2014-04-08 Committee Meeting Agenda - Addendum,Committees - Committee Meeting - Addendums,pdf
04/22/2014,2014-04-22 Committee Meeting Agenda - Addendum,Committees - Committee Meeting - Addendums,pdf
05/20/2014,2014-05-20 Committee Meeting Agenda - Addendum,Committees - Committee Meeting - Addendums,pdf
06/25/2014,2014-06-25 Committee Meeting Agenda - Addendum,Committees - Committee Meeting - Addendums,pdf
07/08/2014,2014-07-08 Committee Meeting Agenda - Addendum,Committees - Committee Meeting - Addendums,pdf
10/07/2014,2014-10-07 Committee Meeting Agenda - Addendum,Committees - Committee Meeting - Addendums,pdf
10/28/2014,2014-10-28 Committee Meeting Agenda - Addendum,Committees - Committee Meeting - Addendums,pdf
11/18/2014,2014-11-18 Committee Meeting Agenda - Addendum,Committees - Committee Meeting - Addendums,pdf
12/16/2014,2014-12-16 Committee Meeting Agenda - Addendum,Committees - Committee Meeting - Addendums,pdf
02/03/2015,2015-02-03 Committee Meeting Agenda - Addendum,Committees - Committee Meeting - Addendums,pdf
11/18/2014,2014-11-18 Community Development and Human Resources Agenda,Committees - Community Development and Human Resources,pdf
12/02/2014,2014-12-02 Community Development and Human Resources Agenda,Committees - Community Development and Human Resources,pdf
12/16/2014,2014-12-16 Community Development and Human Resources Agenda,Committees - Community Development and Human Resources,pdf
01/06/2015,2015-01-06 Community Development and Human Resources Agenda,Committees - Community Development and Human Resources,pdf
01/04/2011,2011-01-04 Community Services and Roads & Transportation Agenda,Committees - Community Service and Roads and Transportation,pdf
12/06/2011,2011-12-06 Community Services and Roads & Transportation Agenda,Committees - Community Service and Roads and Transportation,pdf
12/20/2011,2011-12-20 Community Services and Roads & Transportation Agenda,Committees - Community Service and Roads and Transportation,pdf
01/05/2012,2012-01-05 Community Services and Roads & Transportation Agenda,Committees - Community Service and Roads and Transportation,pdf
01/18/2012,2012-01-18 Community Services and Roads & Transportation Agenda,Committees - Community Service and Roads and Transportation,pdf
02/07/2012,2012-02-07 Community Services and Roads & Transportation Agenda,Committees - Community Service and Roads and Transportation,pdf
02/22/2012,2012-02-22 Community Services and Roads & Transportation Agenda,Committees - Community Service and Roads and Transportation,pdf
03/06/2012,2012-03-06 Community Services and Roads & Transportation Agenda,Committees - Community Service and Roads and Transportation,pdf
03/20/2012,2012-03-20 Community Services and Roads & Transportation Agenda,Committees - Community Service and Roads and Transportation,pdf
04/03/2012,2012-04-03 Community Services and Roads & Transportation Agenda,Committees - Community Service and Roads and Transportation,pdf
04/17/2012,2012-04-17 Community Services and Roads & Transportation Agenda,Committees - Community Service and Roads and Transportation,pdf
05/04/2012,2012-05-04 Community Services and Roads & Transportation Agenda,Committees - Community Service and Roads and Transportation,pdf
05/17/2012,2012-05-17 Community Services and Roads & Transportation Agenda,Committees - Community Service and Roads and Transportation,pdf
06/05/2012,2012-06-05 Community Services and Roads & Transportation Agenda,Committees - Community Service and Roads and Transportation,pdf
06/19/2012,2012-06-19 Community Services and Roads & Transportation Agenda,Committees - Community Service and Roads and Transportation,pdf
07/10/2012,2012-07-10 Community Services and Roads & Transportation Agenda,Committees - Community Service and Roads and Transportation,pdf
07/24/2012,2012-07-24 Community Services and Roads & Transportation Agenda,Committees - Community Service and Roads and Transportation,pdf
08/07/2012,2012-08-07 Community Services and Roads & Transportation Agenda,Committees - Community Service and Roads and Transportation,pdf
08/21/2012,2012-08-21 Community Services and Roads & Transportation Agenda,Committees - Community Service and Roads and Transportation,pdf
09/05/2012,2012-09-05 Community Services and Roads & Transportation Agenda,Committees - Community Service and Roads and Transportation,pdf
09/18/2012,2012-09-18 Community Services and Roads & Transportation Agenda,Committees - Community Service and Roads and Transportation,pdf
10/02/2012,2012-10-02 Community Services and Roads & Transportation Agenda - Draft,Committees - Community Service and Roads and Transportation,pdf
10/16/2012,2012-10-16 Community Services and Roads & Transportation Agenda,Committees - Community Service and Roads and Transportation,pdf
11/21/2012,2012-11-21 Community Services and Roads & Transportation Agenda,Committees - Community Service and Roads and Transportation,pdf
12/05/2012,2012-12-05 Community Services and Roads & Transportation Agenda,Committees - Community Service and Roads and Transportation,pdf
12/10/2012,2012-12-10 Community Services and Roads & Transportation Agenda,Committees - Community Service and Roads and Transportation,pdf
12/18/2012,2012-12-18 Community Services and Roads & Transportation Agenda,Committees - Community Service and Roads and Transportation,pdf
01/15/2013,2013-01-15 Community Services and Roads & Transportation Agenda,Committees - Community Service and Roads and Transportation,pdf
01/30/2013,2013-01-30 Community Services and Roads & Transportation Agenda,Committees - Community Service and Roads and Transportation,pdf
02/12/2013,2013-02-12 Community Services and Roads & Transportation Agenda,Committees - Community Service and Roads and Transportation,pdf
02/26/2013,2013-02-26 Community Services and Roads & Transportation Agenda,Committees - Community Service and Roads and Transportation,pdf
03/11/2013,2013-03-11 Community Services and Roads & Transportation Agenda,Committees - Community Service and Roads and Transportation,pdf
03/26/2013,2013-03-26 Community Services and Roads & Transportation Agenda,Committees - Community Service and Roads and Transportation,pdf
04/09/2013,2013-04-09 Community Services and Roads & Transportation Agenda,Committees - Community Service and Roads and Transportation,pdf
04/23/2013,2013-04-23 Community Services and Roads & Transportation Agenda,Committees - Community Service and Roads and Transportation,pdf
05/14/2013,2013-05-14 Community Services and Roads & Transportation Agenda,Committees - Community Service and Roads and Transportation,pdf
05/29/2013,2013-05-29 Community Services and Roads & Transportation Agenda,Committees - Community Service and Roads and Transportation,pdf
06/11/2013,2013-06-11 Community Services and Roads & Transportation Agenda,Committees - Community Service and Roads and Transportation,pdf
06/25/2013,2013-06-25 Community Services and Roads & Transportation Agenda,Committees - Community Service and Roads and Transportation,pdf
07/09/2013,2013-07-09 Community Services and Roads & Transportation Agenda,Committees - Community Service and Roads and Transportation,pdf
08/13/2013,2013-08-13 Community Services and Roads & Transportation Agenda,Committees - Community Service and Roads and Transportation,pdf
08/27/2013,2013-08-27 Community Services and Roads & Transportation Agenda,Committees - Community Service and Roads and Transportation,pdf
09/10/2013,2013-09-10 Community Services and Roads & Transportation Agenda,Committees - Community Service and Roads and Transportation,pdf
09/24/2013,2013-09-24 Community Services and Roads & Transportation Agenda,Committees - Community Service and Roads and Transportation,pdf
10/08/2013,2013-10-08 Community Services and Roads & Transportation Agenda,Committees - Community Service and Roads and Transportation,pdf
10/21/2013,2013-10-21 Community Services and Roads & Transportation Agenda,Committees - Community Service and Roads and Transportation,pdf
11/06/2013,2013-11-06 Community Services and Roads & Transportation Agenda,Committees - Community Service and Roads and Transportation,pdf
11/26/2013,2013-11-26 Community Services and Roads & Transportation Agenda,Committees - Community Service and Roads and Transportation,pdf
12/04/2013,2013-12-04 Community Services and Roads & Transportation Agenda,Committees - Community Service and Roads and Transportation,pdf
12/17/2013,2013-12-17 Community Services and Roads & Transportation Agenda,Committees - Community Service and Roads and Transportation,pdf
01/07/2014,2014-01-07 Community Services and Roads & Transportation Agenda,Committees - Community Service and Roads and Transportation,pdf
01/28/2014,2014-01-28 Community Services and Roads & Transportation Agenda,Committees - Community Service and Roads and Transportation,pdf
02/25/2014,2014-02-25 Community Services and Roads & Transportation Agenda,Committees - Community Service and Roads and Transportation,pdf
03/11/2014,2014-03-11 Community Services and Roads & Transportation Agenda,Committees - Community Service and Roads and Transportation,pdf
03/25/2014,2014-03-25 Community Services and Roads & Transportation Agenda,Committees - Community Service and Roads and Transportation,pdf
04/08/2014,2014-04-08 Community Services and Roads & Transportation Agenda,Committees - Community Service and Roads and Transportation,pdf
04/22/2014,2014-04-22 Community Services and Roads & Transportation Agenda,Committees - Community Service and Roads and Transportation,pdf
05/06/2014,2014-05-06 Community Services and Roads & Transportation Agenda,Committees - Community Service and Roads and Transportation,pdf
06/10/2014,2014-06-10 Community Services and Roads & Transportation Agenda,Committees - Community Service and Roads and Transportation,pdf
06/25/2014,2014-06-25 Community Services and Roads & Transportation Agenda,Committees - Community Service and Roads and Transportation,pdf
07/08/2014,2014-07-08 Community Services and Roads & Transportation Agenda,Committees - Community Service and Roads and Transportation,pdf
07/22/2014,2014-07-22 Community Services and Roads & Transportation Agenda,Committees - Community Service and Roads and Transportation,pdf
08/12/2014,2014-08-12 Community Services and Roads & Transportation Agenda,Committees - Community Service and Roads and Transportation,pdf
08/26/2014,2014-08-26 Community Services and Roads & Transportation Agenda,Committees - Community Service and Roads and Transportation,pdf
09/09/2014,2014-09-09 Community Services and Roads & Transportation Agenda,Committees - Community Service and Roads and Transportation,pdf
09/23/2014,2014-09-23 Community Services and Roads & Transportation Agenda,Committees - Community Service and Roads and Transportation,pdf
10/07/2014,2014-10-07 Community Services and Roads & Transportation Agenda,Committees - Community Service and Roads and Transportation,pdf
10/28/2014,2014-10-28 Community Services and Roads & Transportation Agenda,Committees - Community Service and Roads and Transportation,pdf
12/21/2010,2010-12-21 Finance and Information Technology Agenda,Committees - Finance Information Technology,pdf
01/18/2011,2011-01-18 Finance and Information Technology Agenda,Committees - Finance Information Technology,pdf
02/01/2011,2011-02-01 Finance and Information Technology Agenda,Committees - Finance Information Technology,pdf
12/06/2011,2011-12-06 Finance and Information Technology Agenda,Committees - Finance Information Technology,pdf
12/20/2011,2011-12-20 Finance and Information Technology Agenda,Committees - Finance Information Technology,pdf
01/05/2012,2012-01-05 Finance and Information Technology Agenda,Committees - Finance Information Technology,pdf
01/18/2012,2012-01-18 Finance and Information Technology Agenda,Committees - Finance Information Technology,pdf
02/07/2012,2012-02-07 Finance and Information Technology Agenda,Committees - Finance Information Technology,pdf
02/22/2012,2012-02-22 Finance and Information Technology Agenda,Committees - Finance Information Technology,pdf
03/06/2012,2012-03-06 Finance and Information Technology Agenda,Committees - Finance Information Technology,pdf
03/20/2012,2012-03-20 Finance and Information Technology Agenda,Committees - Finance Information Technology,pdf
04/03/2012,2012-04-03 Finance and Information Technology Agenda,Committees - Finance Information Technology,pdf
04/17/2012,2012-04-17 Finance and Information Technology Agenda,Committees - Finance Information Technology,pdf
05/04/2012,2012-05-04 Finance and Information Technology Agenda,Committees - Finance Information Technology,pdf
05/17/2012,2012-05-17 Finance and Information Technology Agenda,Committees - Finance Information Technology,pdf
06/05/2012,2012-06-05 Finance and Information Technology Agenda,Committees - Finance Information Technology,pdf
06/19/2012,2012-06-19 Finance and Information Technology Agenda,Committees - Finance Information Technology,pdf
06/20/2012,2012-06-20 Finance and Information Technology Commitee Meeting Notice,Committees - Finance Information Technology,pdf
07/10/2012,2012-07-10 Finance and Information Technology Agenda,Committees - Finance Information Technology,pdf
07/24/2012,2012-07-24 Finance and Information Technology Agenda,Committees - Finance Information Technology,pdf
08/07/2012,2012-08-07 Finance and Information Technology Agenda,Committees - Finance Information Technology,pdf
08/21/2012,2012-08-21 Finance and Information Technology Agenda,Committees - Finance Information Technology,pdf
09/05/2012,2012-09-05 Finance and Information Technology Agenda,Committees - Finance Information Technology,pdf
09/18/2012,2012-09-18 Finance and Information Technology Agenda,Committees - Finance Information Technology,pdf
10/02/2012,2012-10-02 Finance and Information Technology Agenda - Draft,Committees - Finance Information Technology,pdf
10/16/2012,2012-10-16 Finance and Information Technology Agenda,Committees - Finance Information Technology,pdf
11/21/2012,2012-11-21 Finance and Information Technology Agenda,Committees - Finance Information Technology,pdf
12/05/2012,2012-12-05 Finance and Information Technology Agenda,Committees - Finance Information Technology,pdf
12/10/2012,2012-12-10 Finance and Information Technology Agenda,Committees - Finance Information Technology,pdf
12/18/2012,2012-12-18 Finance and Information Technology Agenda,Committees - Finance Information Technology,pdf
01/15/2013,2013-01-15 Finance and Information Technology Agenda,Committees - Finance Information Technology,pdf
01/30/2013,2013-01-30 Finance and Information Technology Agenda,Committees - Finance Information Technology,pdf
02/12/2013,2013-02-12 Finance and Information Technology Agenda,Committees - Finance Information Technology,pdf
02/26/2013,2013-02-26 Finance and Information Technology Agenda,Committees - Finance Information Technology,pdf
03/11/2013,2013-03-11 Finance and Information Technology Agenda,Committees - Finance Information Technology,pdf
03/26/2013,2013-03-26 Finance and Information Technology Agenda,Committees - Finance Information Technology,pdf
04/09/2013,2013-04-09 Finance and Information Technology Agenda,Committees - Finance Information Technology,pdf
04/23/2013,2013-04-23 Finance and Information Technology Agenda,Committees - Finance Information Technology,pdf
05/14/2013,2013-05-14 Finance and Information Technology Agenda,Committees - Finance Information Technology,pdf
05/29/2013,2013-05-29 Finance and Information Technology Agenda,Committees - Finance Information Technology,pdf
06/11/2013,2013-06-11 Finance and Information Technology Agenda,Committees - Finance Information Technology,pdf
06/25/2013,2013-06-25 Finance and Information Technology Agenda,Committees - Finance Information Technology,pdf
07/09/2013,2013-07-09 Finance and Information Technology Agenda,Committees - Finance Information Technology,pdf
08/13/2013,2013-08-13 Finance and Information Technology Agenda,Committees - Finance Information Technology,pdf
08/27/2013,2013-08-27 Finance and Information Technology Agenda,Committees - Finance Information Technology,pdf
09/10/2013,2013-09-10 Finance and Information Technology Agenda,Committees - Finance Information Technology,pdf
09/17/2013,2013-09-17 Finance and Information Technology Agenda,Committees - Finance Information Technology,pdf
09/24/2013,2013-09-24 Finance and Information Technology Agenda,Committees - Finance Information Technology,pdf
10/08/2013,2013-10-08 Finance and Information Technology Agenda,Committees - Finance Information Technology,pdf
10/21/2013,2013-10-21 Finance and Information Technology Agenda,Committees - Finance Information Technology,pdf
11/06/2013,2013-11-06 Finance and Information Technology Agenda,Committees - Finance Information Technology,pdf
11/26/2013,2013-11-26 Finance and Information Technology Agenda,Committees - Finance Information Technology,pdf
12/04/2013,2013-12-04 Finance and Information Technology Agenda,Committees - Finance Information Technology,pdf
12/17/2013,2013-12-17 Finance and Information Technology Agenda,Committees - Finance Information Technology,pdf
01/07/2014,2014-01-07 Finance and Information Technology Agenda,Committees - Finance Information Technology,pdf
01/28/2014,2014-01-28 Finance and Information Technology Agenda,Committees - Finance Information Technology,pdf
02/25/2014,2014-02-25 Finance and Information Technology Agenda,Committees - Finance Information Technology,pdf
03/11/2014,2014-03-11 Finance and Information Technology Agenda,Committees - Finance Information Technology,pdf
03/25/2014,2014-03-25 Finance and Information Technology Agenda,Committees - Finance Information Technology,pdf
04/08/2014,2014-04-08 Finance and Information Technology Agenda,Committees - Finance Information Technology,pdf
04/22/2014,2014-04-22 Finance and Informaiton Technology Agenda,Committees - Finance Information Technology,pdf
05/06/2014,2014-05-06 Finance and Information Technology Agenda,Committees - Finance Information Technology,pdf
06/10/2014,2014-06-10 Finance and Information Technology Agenda,Committees - Finance Information Technology,pdf
06/25/2014,2014-06-25 Finance and Information Technology Agenda,Committees - Finance Information Technology,pdf
07/08/2014,2014-07-08 Finance and Information Technology Agenda,Committees - Finance Information Technology,pdf
07/22/2014,2014-07-22 Finance and Information Technology Agenda,Committees - Finance Information Technology,pdf
08/12/2014,2014-08-12 Finance and Information Technology Agenda,Committees - Finance Information Technology,pdf
08/26/2014,2014-08-26 Finance and Information Technology Agenda,Committees - Finance Information Technology,pdf
09/09/2014,2014-09-09 Finance and Information Technology Agenda,Committees - Finance Information Technology,pdf
09/23/2014,2014-09-23 Finance and Information Technology Agenda,Committees - Finance Information Technology,pdf
10/07/2014,2014-10-07 Finance and Information Technology Agenda,Committees - Finance Information Technology,pdf
10/28/2014,2014-10-28 Finance and Information Technology Agenda,Committees - Finance Information Technology,pdf
11/18/2014,"2014-11-18 Finance, Information Technology and Business Development Agenda",Committees - Finance IT and Business Development,pdf
12/02/2014,"2014-12-02 Finance, Information Technology and Business Development Agenda",Committees - Finance IT and Business Development,pdf
12/16/2014,"2014-12-16 Finance, Information Technology and Business Development Agenda",Committees - Finance IT and Business Development,pdf
01/06/2015,"2015-01-06 Finance, Information Technology and Business Development Agenda",Committees - Finance IT and Business Development,pdf
12/06/2011,2011-12-06 Health and General Services Agenda,Committees - Health and General Services,pdf
01/05/2012,2012-01-05 Health and General Services Agenda,Committees - Health and General Services,pdf
01/18/2012,2012-01-18 Health and General Services Agenda,Committees - Health and General Services,pdf
02/07/2012,2012-02-07 Health and General Services Agenda,Committees - Health and General Services,pdf
02/22/2012,2012-02-22 Health and General Services Agenda,Committees - Health and General Services,pdf
03/06/2012,2012-03-06 Health and General Services Agenda,Committees - Health and General Services,pdf
03/09/2012,2012-03-09 Health and General Services Agenda,Committees - Health and General Services,pdf
03/20/2012,2012-03-20 Health and General Services Agenda,Committees - Health and General Services,pdf
04/03/2012,2012-04-03 Health and General Services Agenda,Committees - Health and General Services,pdf
04/17/2012,2012-04-17 Health and General Services Agenda,Committees - Health and General Services,pdf
05/04/2012,2012-05-04 Health and General Services Agenda,Committees - Health and General Services,pdf
05/17/2012,2012-05-17 Health and General Services Agenda,Committees - Health and General Services,pdf
06/05/2012,2012-06-05 Health and General Services Agenda,Committees - Health and General Services,pdf
06/19/2012,2012-06-19 Health and General Services Agenda,Committees - Health and General Services,pdf
07/10/2012,2012-07-10 Health and General Services Agenda,Committees - Health and General Services,pdf
07/24/2012,2012-07-24 Health and General Services Agenda,Committees - Health and General Services,pdf
08/07/2012,2012-08-07 Health and General Services Agenda,Committees - Health and General Services,pdf
08/21/2012,2012-08-21 Health and General Services Agenda,Committees - Health and General Services,pdf
08/27/2012,2012-08-27 Health and General Services Agenda,Committees - Health and General Services,pdf
09/05/2012,2012-09-05 Health and General Services Agenda,Committees - Health and General Services,pdf
09/18/2012,2012-09-18 Health and General Services Agenda,Committees - Health and General Services,pdf
10/02/2012,2012-10-02 Health and General Services Agenda - Draft,Committees - Health and General Services,pdf
10/16/2012,2012-10-16 Health and General Services Agenda,Committees - Health and General Services,pdf
11/21/2012,2012-11-21 Health and General Services Agenda,Committees - Health and General Services,pdf
12/05/2012,2012-12-05 Health and General Services Agenda,Committees - Health and General Services,pdf
12/10/2012,2012-12-10 Health and General Services Agenda,Committees - Health and General Services,pdf
12/18/2012,2012-12-18 Health and General Services Agenda,Committees - Health and General Services,pdf
01/15/2013,2013-01-15 Health and General Services Agenda,Committees - Health and General Services,pdf
01/30/2012,2013-01-30 Health and General Services Agenda,Committees - Health and General Services,pdf
02/12/2013,2013-02-12 Health and General Services Agenda,Committees - Health and General Services,pdf
02/26/2013,2013-02-26 Health and General Services Agenda,Committees - Health and General Services,pdf
03/11/2013,2013-03-11 Health and General Services Agenda,Committees - Health and General Services,pdf
03/26/2013,2013-03-26 Health and General Services Agenda,Committees - Health and General Services,pdf
04/09/2013,2013-04-09 Health and General Services Agenda,Committees - Health and General Services,pdf
04/23/2013,2013-04-23 Health and General Services Agenda,Committees - Health and General Services,pdf
05/14/2013,2013-05-14 Health and General Services Agenda,Committees - Health and General Services,pdf
05/29/2013,2013-05-29 Health and General Services Agenda,Committees - Health and General Services,pdf
06/11/2013,2013-06-11 Health and General Services Agenda,Committees - Health and General Services,pdf
06/25/2013,2013-06-25 Health and General Services Agenda,Committees - Health and General Services,pdf
07/09/2013,2013-07-09 Health and General Services Agenda,Committees - Health and General Services,pdf
08/13/2013,2013-08-13 Health and General Services Agenda,Committees - Health and General Services,pdf
08/27/2013,2013-08-27 Health and General Services Agenda,Committees - Health and General Services,pdf
09/10/2013,2013-09-10 Health and General Services Agenda,Committees - Health and General Services,pdf
09/24/2013,2013-09-24 Health and General Services Agenda,Committees - Health and General Services,pdf
10/08/2013,2013-10-08 Health and General Services Agenda,Committees - Health and General Services,pdf
10/21/2013,2013-10-21 Health and General Services Agenda,Committees - Health and General Services,pdf
11/06/2013,2013-11-06 Health and General Services Agenda,Committees - Health and General Services,pdf
11/26/2013,2013-11-26 Health and General Services Agenda,Committees - Health and General Services,pdf
12/04/2013,2013-12-04 Health and General Services Agenda,Committees - Health and General Services,pdf
12/17/2013,2013-12-17 Health and General Services Agenda,Committees - Health and General Services,pdf
01/07/2014,2014-01-07 Health and General Services Agenda,Committees - Health and General Services,pdf
01/28/2014,2014-01-28 Health and General Services Agenda,Committees - Health and General Services,pdf
02/25/2014,2014-02-25 Health and General Services Agenda,Committees - Health and General Services,pdf
03/11/2014,2014-03-11 Health and General Services Agenda,Committees - Health and General Services,pdf
03/25/2014,2014-03-25 Health and General Services Agenda,Committees - Health and General Services,pdf
04/08/2014,2014-04-08 Health and General Services Agenda,Committees - Health and General Services,pdf
04/22/2014,2014-04-22 Health and General Services Agenda,Committees - Health and General Services,pdf
05/06/2014,2014-05-06 Health and General Services Agenda,Committees - Health and General Services,pdf
06/10/2014,2014-06-10 Health and General Services Agenda,Committees - Health and General Services,pdf
06/25/2014,2014-06-25 Health and General Services Agenda,Committees - Health and General Services,pdf
07/08/2014,2014-07-08 Health and General Services Agenda,Committees - Health and General Services,pdf
07/22/2014,2014-07-22 Health and General Services Agenda,Committees - Health and General Services,pdf
08/12/2014,2014-08-12 Health and General Services Agneda,Committees - Health and General Services,pdf
08/26/2014,2014-08-26 Health and General Services Agenda,Committees - Health and General Services,pdf
09/09/2014,2014-09-09 Health and General Services Agenda,Committees - Health and General Services,pdf
09/23/2014,2014-09-23 Health and General Services Agenda,Committees - Health and General Services,pdf
10/07/2014,2014-10-07 Health and General Services Agenda,Committees - Health and General Services,pdf
10/28/2014,2014-10-28 Health and General Services Agenda,Committees - Health and General Services,pdf
11/18/2014,2014-11-18 Health and General Services Agenda,Committees - Health and General Services,pdf
12/02/2014,2014-12-02 Health and General Services Agenda,Committees - Health and General Services,pdf
12/16/2014,2014-12-16 Health and General Services Agenda,Committees - Health and General Services,pdf
01/06/2015,2015-01-06 Health and General Services Agenda,Committees - Health and General Services,pdf
11/18/2014,"2014-11-18 Judicial Administration, Emergency Management and Land Planning Agenda",Committees - Judicial Administration EMA and Land Planning,pdf
12/02/2014,"2014-12-02 Judicial Administration, Emergency Management and Land Planning Agenda",Committees - Judicial Administration EMA and Land Planning,pdf
12/16/2014,"2014-12-16 Judicial Administration, Emergency Management and Land Planning Agenda",Committees - Judicial Administration EMA and Land Planning,pdf
01/06/2015,"2015-01-06 Judicial Administration, Emergency Management and Land Planning Agenda",Committees - Judicial Administration EMA and Land Planning,pdf
,"2011-12-20 Land Planning, EMA, Courts and Inspection Services Agenda",Committees - Land Planning EMA Courts Inspection Services,pdf
,"2012-01-05 Land Planning, EMA, Courts and Inspection Services Agenda",Committees - Land Planning EMA Courts Inspection Services,pdf
,"2012-01-18 Land Planning, EMA, Courts and Inspection Services Agenda",Committees - Land Planning EMA Courts Inspection Services,pdf
,"2012-02-07 Land Planning, EMA, Courts and Inspection Services Agenda",Committees - Land Planning EMA Courts Inspection Services,pdf
,"2012-02-22 Land Planning, EMA, Courts and Inspection Services Agenda",Committees - Land Planning EMA Courts Inspection Services,pdf
,"2012-03-06 Land Planning, EMA, Courts and Inspection Services Agenda",Committees - Land Planning EMA Courts Inspection Services,pdf
,"2012-03-20 Land Planning, EMA, Courts and Inspection Services Agenda",Committees - Land Planning EMA Courts Inspection Services,pdf
,"2012-04-03 Land Planning, EMA, Courts and Inspection Services Agenda",Committees - Land Planning EMA Courts Inspection Services,pdf
,"2012-04-17 Land Planning, EMA, Courts and Inspection Services Agenda",Committees - Land Planning EMA Courts Inspection Services,pdf
,"2012-05-04 Land Planning, EMA, Courts and Inspection Services Agenda",Committees - Land Planning EMA Courts Inspection Services,pdf
,"2012-05-17 Land Planning, EMA, Courts and Inspection Services Agenda",Committees - Land Planning EMA Courts Inspection Services,pdf
,"2012-06-05 Land Planning, EMA, Courts and Inspection Services Agenda",Committees - Land Planning EMA Courts Inspection Services,pdf
,"2012-06-19 Land Planning, EMA, Courts and Inspection Services Agenda",Committees - Land Planning EMA Courts Inspection Services,pdf
,"2012-07-10 Land Planning, EMA, Courts and Inspection Services Agenda",Committees - Land Planning EMA Courts Inspection Services,pdf
,"2012-07-24 Land Planning, EMA, Courts and Inspection Services Agenda",Committees - Land Planning EMA Courts Inspection Services,pdf
,"2012-08-07 Land Planning, EMA, Courts and Inspection Services Agenda",Committees - Land Planning EMA Courts Inspection Services,pdf
,"2012-08-21 Land Planning, EMA, Courts and Inspection Services Agenda",Committees - Land Planning EMA Courts Inspection Services,pdf
,"2012-09-05 Land Planning, EMA, Courts and Inspection Services Agenda",Committees - Land Planning EMA Courts Inspection Services,pdf
,"2012-09-18 Land Planning, EMA, Courts and Inspection Services Agenda",Committees - Land Planning EMA Courts Inspection Services,pdf
,"2012-10-02 Land Planning, EMA, Courts and Inspection Services Agenda - Draft",Committees - Land Planning EMA Courts Inspection Services,pdf
,"2012-10-16 Land Planning, EMA, Courts and Inspection Services Agenda",Committees - Land Planning EMA Courts Inspection Services,pdf
,"2012-11-21 Land Planning, EMA, Courts and Inspection Services Agenda",Committees - Land Planning EMA Courts Inspection Services,pdf
,"2012-12-05 Land Planning, EMA, Courts and Inspection Services Agenda",Committees - Land Planning EMA Courts Inspection Services,pdf
,"2012-12-10 Land Planning, EMA, Courts and Inspection Services Agenda",Committees - Land Planning EMA Courts Inspection Services,pdf
,"2012-12-18 Land Planning, EMA, Courts and Inspection Services Agenda",Committees - Land Planning EMA Courts Inspection Services,pdf
,"2013-01-15 Land Planning, EMA, Courts and Inspection Services Agenda",Committees - Land Planning EMA Courts Inspection Services,pdf
,"2013-01-30 Land Planning, EMA, Courts and Inspection Services Agenda",Committees - Land Planning EMA Courts Inspection Services,pdf
,"2013-02-12 Land Planning, EMA, Courts and Inspection Services Agenda",Committees - Land Planning EMA Courts Inspection Services,pdf
,"2013-02-26 Land Planning, EMA, Courts and Inspection Services Agenda",Committees - Land Planning EMA Courts Inspection Services,pdf
,"2013-03-11 Land Planning, EMA, Courts and Inspection Services Agenda",Committees - Land Planning EMA Courts Inspection Services,pdf
,"2013-03-26 Land Planning, EMA, Courts and Inspection Services Agenda",Committees - Land Planning EMA Courts Inspection Services,pdf
,"2013-04-09 Land Planning, EMA, Courts and Inspection Services Agenda",Committees - Land Planning EMA Courts Inspection Services,pdf
01/30/2014,"2013-04-13 Land Planning, EMA, Courts and Inspection Services Agenda",Committees - Land Planning EMA Courts Inspection Services,pdf
,"2013-04-23 Land Planning, EMA, Courts and Inspection Services Agenda",Committees - Land Planning EMA Courts Inspection Services,pdf
,"2013-05-14 Land Planning, EMA, Courts and Inspection Services Agenda",Committees - Land Planning EMA Courts Inspection Services,pdf
,"2013-05-29 Land Planning, EMA, Courts and Inspection Services Agenda",Committees - Land Planning EMA Courts Inspection Services,pdf
,"2013-06-11 Land Planning, EMA, Courts and Inspection Services Agenda",Committees - Land Planning EMA Courts Inspection Services,pdf
,"2013-06-25 Land Planning, EMA, Courts and Inspection Services Agenda",Committees - Land Planning EMA Courts Inspection Services,pdf
,"2013-07-09 Land Planning, EMA, Courts and Inspection Services Agenda",Committees - Land Planning EMA Courts Inspection Services,pdf
,"2013-08-13 Land Planning, EMA, Courts and Inspection Services Agenda",Committees - Land Planning EMA Courts Inspection Services,pdf
,"2013-08-27 Land Planning, EMA, Courts and Inspection Services Agenda",Committees - Land Planning EMA Courts Inspection Services,pdf
,"2013-09-10 Land Planning, EMA, Courts and Inspection Services Agenda",Committees - Land Planning EMA Courts Inspection Services,pdf
09/24/2013,"2013-09-24 Land Planning, EMA, Courts and Inspection Services Agenda",Committees - Land Planning EMA Courts Inspection Services,pdf
10/08/2013,"2013-10-08 Land Planning, EMA, Courts and Inspection Services Agenda",Committees - Land Planning EMA Courts Inspection Services,pdf
10/21/2013,"2013-10-21 Land Planning, EMA, Courts and Inspection Services Agenda",Committees - Land Planning EMA Courts Inspection Services,pdf
11/06/2013,"2013-11-06 Land Planning, EMA, Courts and Inspection Services Agenda",Committees - Land Planning EMA Courts Inspection Services,pdf
11/26/2013,"2013-11-26 Land Planning, EMA, Courts and Inspection Services Agenda",Committees - Land Planning EMA Courts Inspection Services,pdf
12/17/2013,"2013-12-17 Land Planning, EMA, Courts and Inspection Services Agenda",Committees - Land Planning EMA Courts Inspection Services,pdf
01/07/2014,"2014-01-07 Land Planning, EMA, Courts and Inspection Services Agenda",Committees - Land Planning EMA Courts Inspection Services,pdf
01/28/2014,"2014-01-28 Land Planning, EMA, Courts and Inspection Services Agenda",Committees - Land Planning EMA Courts Inspection Services,pdf
02/25/2014,"2014-02-25 Land Planning, EMA, Courts and Inspection Services Agenda",Committees - Land Planning EMA Courts Inspection Services,pdf
03/11/2014,"2014-03-11 Land Planning, EMA, Courts and Inspection Services Agenda",Committees - Land Planning EMA Courts Inspection Services,pdf
03/25/2014,"2014-03-25 Land Planning, EMA, Courts and Inspection Services Agenda",Committees - Land Planning EMA Courts Inspection Services,
04/08/2014,"2014-04-08 Land Planning, EMA, Courts and Inspection Services Agneda",Committees - Land Planning EMA Courts Inspection Services,pdf
04/22/2014,"2014-04-22 Land Planning, EMA, Courts and Inspection Services Agenda",Committees - Land Planning EMA Courts Inspection Services,pdf
05/06/2014,"2014-05-06 Land Planning, EMA, Courts and Inspection Services Agenda",Committees - Land Planning EMA Courts Inspection Services,pdf
06/10/2014,"2014-06-10 Land Planning, EMA, Courts and Inspection Services Agenda",Committees - Land Planning EMA Courts Inspection Services,pdf
06/25/2014,"2014-06-25 Land Planning, EMA, Courts and Inspection Services Agenda",Committees - Land Planning EMA Courts Inspection Services,pdf
07/08/2014,"2014-07-08 Land Planning, EMA, Courts and Inspection Services Agenda",Committees - Land Planning EMA Courts Inspection Services,pdf
07/22/2014,"2014-07-22 Land Planning, EMA, Courts and Inspection Services Agenda",Committees - Land Planning EMA Courts Inspection Services,pdf
08/12/2014,"2014-08-12 Land Planning, EMA, Courts and Inspection Sevices Agenda",Committees - Land Planning EMA Courts Inspection Services,pdf
08/26/2014,"2014-08-26 Land Planning, EMA, Courts and Inspection Services Agenda",Committees - Land Planning EMA Courts Inspection Services,pdf
09/09/2014,"2014-09-09 Land Planning, EMA, Courts and Inspection Services Agenda",Committees - Land Planning EMA Courts Inspection Services,pdf
09/23/2014,"2014-09-23 Land Planning, EMA, Courts and Inspection Services Agenda",Committees - Land Planning EMA Courts Inspection Services,pdf
10/07/2014,"2014-10-07 Land Planning, EMA, Courts and Inspection Services Agenda",Committees - Land Planning EMA Courts Inspection Services,pdf
10/28/2014,"2014-10-28 Land Planning, EMA, Courts and Inspection Services Agenda",Committees - Land Planning EMA Courts Inspection Services,pdf
,2011-12-01 Active Contracts,General,pdf
,2012-05-01Active Contracts,General,pdf
,Active Contracts,General,pdf
,Business Entity License Ordinace 1801,General,pdf
,Immigration Act 2011-535,General,pdf
,Jefferson County Online Directory,General,pdf
,Occupational Tax Infomation,General,pdf
,Jefferson County Ch 9. Event Notice CUSIP,General - Bankruptcy Documents,pdf
,Jefferson County Ch. 9 Notice to Employees,General - Bankruptcy Documents,pdf
,Jefferson County Ch. 9 Notice to Vendors,General - Bankruptcy Documents,pdf
,Jefferson County Ch. 9 Notice to Vendors- Updated,General - Bankruptcy Documents,pdf
,Jefferson County Ch. 9 Press Release,General - Bankruptcy Documents,pdf
,Jefferson County Ch. 9 Resolution,General - Bankruptcy Documents,pdf
,Jefferson ounty Ch 9 Petition,General - Bankruptcy Documents,pdf
,Business License Annual Receipts Affidavit,General - Business License Affidavit,pdf
,Jefferson County CFO Posting,General - Docs,pdf
,Oil and Grease Recycling Program,General - Docs,pdf
,General Obligation Debt Press Release,General - GO Debt Resolutions,pdf
,General Obligation Debt Resolution,General - GO Debt Resolutions,pdf
,Sewer Use Administration Ordinance - Adopted,General - Sewer Ordinances,pdf
,Sewer Use Charge Ordinance - Adopted,General - Sewer Ordinances,pdf
,Aflac Cancellation Notice,HR - Benefits,pdf
,Annual Notices,HR - Benefits,pdf
,BCBS Change Form BLANK,HR - Benefits,pdf
,Benefit Rate Sheet,HR - Benefits,pdf
,Benefits Telephone Guide,HR - Benefits,pdf
,Blue Cross Blue Shield Summary Plan Description (SPD),HR - Benefits,pdf
,BlueCard PPO,HR - Benefits,pdf
,Change Term to Vol Life VADD102012,HR - Benefits,pdf
,Dearborn F019105LifeCert1and2,HR - Benefits,pdf
,Dental Benefits Summary,HR - Benefits,pdf
,DENTAL CHANGE FORMDELTA,HR - Benefits,pdf
,EDPM TREATMENT AUTHORIZATION FORM,HR - Benefits,pdf
,Flexible Spending Benefits Summary,HR - Benefits,pdf
,Flexible Spending PlanSummary of Material Modifications,HR - Benefits,pdf
01/22/2014,HIPAA Training Handouts,HR - Benefits,pdf
,HIPAA-PRIVACY-NOTICE,HR - Benefits,pdf
,Hiring Freeze,HR - Benefits,pdf
,HR Org Plan,HR - Benefits,pdf
,Humana VisionCare,HR - Benefits,pdf
,Legal Shield CANCELLATION FORM,HR - Benefits,pdf
,Life Insurance Benefit Summary,HR - Benefits,pdf
,Marital Affidavit for Common-Law Spouses,HR - Benefits,pdf
,Mental Health Benefits Highlights Sheet,HR - Benefits,pdf
,Mental HealthAddmDSPD201210rev121712,HR - Benefits,pdf
,Retiree Health Cost Options,HR - Benefits,pdf
,Retiree Matrix,HR - Benefits,pdf
,Summary of Benefits and Coverage,HR - Benefits,pdf
,Summary of Benefits and Coverage Uniform Glossary,HR - Benefits,pdf
,Vacation Leave Bank Form,HR - Benefits,pdf
,Vacation Leave Bank Withdrawal Form,HR - Benefits,pdf
,VISIONCHANGE FORM,HR - Benefits,pdf
,02-3 County Attorney  Valid Operators License,Info - AOS,pdf
,02-5 County Attorney  Employee Unpaid Leaves of Absence (AWOL)  amended 2/25/03,Info - AOS,pdf
,03-1 County Attorney - Access to Public Records Procedure and Fee Schedule - Amended 12/23/2008,Info - AOS,pdf
,03-2 County Commission  Uniform Policy on Outside Work,Info - AOS,pdf
,04-1 County Commission  Electronic Mail System,Info - AOS,pdf
,04-2 County Commission  Procedures to Request Filling Unclassified Positions and for conducting structured interviews,Info - AOS,pdf
,04-3 County Commission  Establish a uniform policy and procedure for the protection of the County's information and technology resources.,Info - AOS,pdf
,04-4 County Commission  Domestic Violence,Info - AOS,pdf
,05-1 County Commission  Establish a uniform policy and procedure governing sale or other conveyance of real property of the County for less than fair market value,Info - AOS,pdf
,05-3 County Commission  Provisional Vacation and Sick Time,Info - AOS,pdf
,06-1 County Commission  Use of Contractors for perform work on Merit System Employees,Info - AOS,pdf
,06-2 County Commission - Policy and Procedure for the use of paid Vacation Leave by Department Head,Info - AOS,pdf
,06-3 County Commission - Policy and procedure for implementation pertaining to the election provided to each Incumbent County Official of an automobile or expense allowance,Info - AOS,pdf
,07-1 County Commission - Policy and procedure to decide whether to appeal final judgements,Info - AOS,pdf
,07-2 County Commission - Unpaid Leave of Absence,Info - AOS,pdf
,07-2 County Commission - Unpaid Leave of Absence - Amended 12/14/10,Info - AOS,pdf
,07-5 Finance - Policy and Procedure for Payment of Unusual Demands,Info - AOS,pdf
,07-5 Finance - Policy and Procedure for Payment of Unusual Demands - Amended 12/14/10,Info - AOS,pdf
,08-4 County Commission - Notice to Potential Contractors/Equal Opportunity,Info - AOS,pdf
,10-1 County Commission - Policy and procedure for employee separation from active County service,Info - AOS,pdf
07/01/2014,14-1 To establish a policy relating to the consideration of certain contracts by the Commission,Info - AOS,pdf
,75-1 Data Processing - Organization,Info - AOS,pdf
,75-4 Central Laundry - Organization,Info - AOS,pdf
,75-5 Community Development - Project Environmental Review,Info - AOS,pdf
,75-6 Finance - Purchasing Policy,Info - AOS,pdf
,75-7 Finance - Budget Management Budget Execution,Info - AOS,pdf
,75-8 Finance - Budget Management Organization,Info - AOS,pdf
,76-1 Community Development - Grants Writing,Info - AOS,pdf
,76-3 General Services - Organization,Info - AOS,pdf
,76-4 Finance - Payroll Check Distribution,Info - AOS,pdf
,77-1 Finance - Payroll Acts of Nature,Info - AOS,pdf
,77-3 Community Development - Organization,Info - AOS,pdf
,77-4 Finance - Payroll Holiday & Court Pay Patrol Division,Info - AOS,pdf
,79-2 Right of Way - Vacation Fees,Info - AOS,pdf
,79-2 Right of Way - Vacation Fees - Amended 01/11/05,Info - AOS,pdf
,81-1 Finance - Payroll Sheriff Officers Overtime,Info - AOS,pdf
,81-2 General Services - Internal Security,Info - AOS,pdf
,83-2 Finance - Payroll Deductions - amended 3/25/92,Info - AOS,pdf
,83-3 Cooper Green - Use by County Employees,Info - AOS,pdf
,84-2 Finance - Payroll Accrued Sick Leave,Info - AOS,pdf
,89-1 Fleet Management - Rolling Stock - Amended 04/20/04,Info - AOS,pdf
,"89-1 Fleet Management - Rolling Stock - amended 4/24/96, 2/26/02, 5/13/03, 5/20/03",Info - AOS,pdf
,89-1 Fleet Management - Rolling Stock - Amended 6/25/03,Info - AOS,pdf
,89-1 Fleet Management - Rolling Stock - Amended 8/24/04,Info - AOS,pdf
,89-2 General Services - Use of County Telephone Equipment,Info - AOS,pdf
,90-1 Finance - Process for Payment to Vendors,Info - AOS,pdf
,90-2 Finance - Purchasing Local Preference,Info - AOS,pdf
,"90-3 Finance - Risk Management General Authority - amended 2/28/96, 3/12/97",Info - AOS,pdf
,91-10 County Commission - Employee Suggestions and Awards,Info - AOS,pdf
,91-11 County Commission - Parking Ticket Validation - amended 11/05/91,Info - AOS,pdf
,91-3 Finance - Budget Changes,Info - AOS,pdf
,91-4 Finance - Risk Management Wartime Health Insurance - amended 8/18/92,Info - AOS,pdf
,91-5 County Commission - Fiscal Responsibility,Info - AOS,pdf
,"91-6 Finance - Risk Management Drug Free Workplace - amended 2/21/95, 5/28/97, 9/28/10",Info - AOS,pdf
,91-8 County Commission - Personal Use of Automobiles and Phones,Info - AOS,pdf
,91-9 Finance - Unusual Demands,Info - AOS,pdf
,92-2 Information Services - Acquisition of Computer Items - amended 8/27/97,Info - AOS,pdf
,92-3 County Commission - Use of Facsimile Machines Transmission,Info - AOS,pdf
,92-4 County Commission - Wearing of Identification Badges,Info - AOS,pdf
,92-5 County Commission - Solicitation,Info - AOS,pdf
,"92-6 County Attorney - Tuition Reimbursement - amended 7/13/93, 6/11/97",Info - AOS,pdf
,92-7 County Attorney - Sexual Harassment Prevention and Grievance,Info - AOS,pdf
,92-8 County Commission - Retirement Conversion Benefit - amended 3/31/93,Info - AOS,pdf
,92-8 County Commission - Retirement Conversion Benefit - Amended 5/24/11,Info - AOS,pdf
,93-1 Amended 11/13/01,Info - AOS,pdf
,93-1 Amended 12/12/06,Info - AOS,pdf
,93-1 Finance - Staff Development Policy - amended 3/13/96; amended 9/17/96;,Info - AOS,pdf
,93-2 Finance - Purchasing Procurement System and Procedures,Info - AOS,pdf
,93-3 County Commission - Smoking Policy  amended 1/13/99,Info - AOS,pdf
,93-4 Construction and Communication - Assignment of 800 MHz Radio Telephone,Info - AOS,pdf
,94-1 County Attorney - Wrongful Use of County Name or Credit,Info - AOS,pdf
,94-2 County Attorney - Employee Unpaid Leaves of Absence  amended 2/2/2000,Info - AOS,pdf
,96-1 Finance - Risk Management Involving Damage to Property,Info - AOS,pdf
,96-2 Finance-Risk Management - Light Duty Pool,Info - AOS,pdf
,99-1 County Commission-Vacation Leave Bank Plan  amended 12/9/99,Info - AOS,pdf
,Administrative Order 09-1: Policy and Procedure Governing the Use of County Motor Vehicles,Info - AOS,pdf
,Administrative Order 09-2: Uniform Policy/Procedure for the Burial of Indigent Persons,Info - AOS,pdf
,Holiday List 2013-2014,Info - Holiday List,pdf
,02-12-00 $260 Million Warrants to be Issued,Info - News Releases,pdf
,03-10-01 Army Corps Withdraws Supersewer Permit,Info - News Releases,pdf
,03-14 Buckelew Receives NACo Award,Info - News Releases,pdf
,03-14-01 New Debt to Raise Rates 10 Percent,Info - News Releases,pdf
,03-30-01 McNair - Career marked by integrity,Info - News Releases,pdf
,03-30-01 McNair quits commission,Info - News Releases,pdf
,03-30-01 McNair's successor,Info - News Releases,pdf
,03-9-01 Public Hearing to Raise Sewer Rates,Info - News Releases,pdf
,03-9-01 US Agency Calls for Supersewer Suspension,Info - News Releases,pdf
,04-11-00 JEFFCO commitment concerning Honda,Info - News Releases,pdf
,05-23-00 County Commission Resolution for JeffCo Schools,Info - News Releases,pdf
,05-31-01 U.S. Supreme Court Rules,Info - News Releases,pdf
,06-19-00 Update with Respect to Litigation Challenging License Taxes,Info - News Releases,pdf
,06-23-01 Jeffco job tax ruled OK,Info - News Releases,pdf
,07-12-01 Investor Relations Forum,Info - News Releases,pdf
,07-18-01 Moody's Upgrades Debt to Aa3 from A1,Info - News Releases,pdf
,08-01-00 Sewer Plant Awards,Info - News Releases,pdf
,08-08-08 Jefferson County Commission Holds Additional Public Forum August 8th at 6:00 PM,Info - News Releases,pdf
,08-08-08 Jefferson County Commission Holds Public Forum August 8th,Info - News Releases,pdf
,08-12-08 Jefferson County Commission Holds Additional Public Forum August 12th at 6:00 PM,Info - News Releases,pdf
,09-06-00 JeffCo Health Care in National Spotlight,Info - News Releases,pdf
,09-07-00 Judge Woodall rules in favor of Jefferson County,Info - News Releases,pdf
,10-26-00 Amendment to Water Emergency,Info - News Releases,pdf
,12-17-01 Jefferson County Investor Relations Program,Info - News Releases,pdf
,2-13-00 Counties Asking For Help With Sewer Problems,Info - News Releases,pdf
,3-13-01 Environmental Lawyer Files Suit on US Agency,Info - News Releases,pdf
,8-1-01 Judge Rochester rulings,Info - News Releases,pdf
09/30/1997,Fiscal Year Ending - 1997,Investor Relations - Audits,pdf
09/30/1998,Fiscal Year Ending - 1998,Investor Relations - Audits,pdf
09/30/1999,Fiscal Year Ending - 1999,Investor Relations - Audits,pdf
09/30/2000,Fiscal Year Ending - 2000,Investor Relations - Audits,pdf
09/30/2001,Fiscal Year Ending - 2001,Investor Relations - Audits,pdf
09/30/2002,Fiscal Year Ending - 2002,Investor Relations - Audits,pdf
09/30/2003,Fiscal Year Ending - 2003,Investor Relations - Audits,pdf
09/30/2004,Fiscal Year Ending - 2004,Investor Relations - Audits,pdf
09/30/2005,Fiscal Year Ending - 2005,Investor Relations - Audits,pdf
09/30/2006,Fiscal Year Ending - 2006,Investor Relations - Audits,pdf
09/30/2007,Fiscal Year Ending - 2007,Investor Relations - Audits,pdf
09/30/2008,Fiscal Year Ending - 2008,Investor Relations - Audits,pdf
09/30/2009,Fiscal Year Ending - 2009,Investor Relations - Audits,pdf
09/30/2010,Fiscal Year Ending - 2010,Investor Relations - Audits,pdf
09/30/2011,Fiscal Year Ending - 2011,Investor Relations - Audits,pdf
09/30/2012,Fiscal Year Ending - 2012,Investor Relations - Audits,pdf
09/30/2013,Fiscal Year Ending - 2013,Investor Relations - Audits,pdf
09/30/2014,Fiscal Year Ending - 2014,Investor Relations - Audits,pdf
10/30/2003,FYE 2003 - Audit Corrected Page (25),Investor Relations - Audits,pdf
10/02/2000,CAFR 1999-2000: Combined Financial Statements,Investor Relations - CAFR,pdf
10/02/2000,CAFR 1999-2000: Financial Section,Investor Relations - CAFR,pdf
10/01/2000,CAFR 1999-2000: Introduction,Investor Relations - CAFR,pdf
10/02/2000,CAFR 1999-2000: Statistical Section,Investor Relations - CAFR,pdf
10/02/2001,CAFR 2000-2001: Combined Financial Statements,Investor Relations - CAFR,pdf
10/02/2001,CAFR 2000-2001: Financial Section,Investor Relations - CAFR,pdf
10/01/2001,CAFR 2000-2001: Introduction,Investor Relations - CAFR,pdf
10/02/2001,CAFR 2000-2001: Statistical Section,Investor Relations - CAFR,pdf
10/02/2002,CAFR 2001-2002: Combined Financial Statements,Investor Relations - CAFR,pdf
10/02/2002,CAFR 2001-2002: Financial Section,Investor Relations - CAFR,pdf
10/01/2002,CAFR 2001-2002: Introduction,Investor Relations - CAFR,pdf
10/02/2002,CAFR 2001-2002: Statistical Section,Investor Relations - CAFR,pdf
10/01/2003,CAFR 2003-2004: Comprehensive Annual Financial Report - 2003,Investor Relations - CAFR,pdf
10/01/2004,CAFR 2003-2004: Comprehensive Annual Financial Report - 2004,Investor Relations - CAFR,pdf
09/30/2009,Disclosure Report FY2009,Investor Relations - Financial Information - Continuing Disclosures,pdf
09/30/2010,Disclosure Report FY2010,Investor Relations - Financial Information - Continuing Disclosures,pdf
09/30/2011,Disclosure Report FY2011,Investor Relations - Financial Information - Continuing Disclosures,pdf
09/30/2012,Disclosure Report FY2012,Investor Relations - Financial Information - Continuing Disclosures,pdf
,"Single Audit - FYE - September 30, 2008",Investor Relations - Financial Information - Single Audits,pdf
,11th Supplement,Investor Relations - Library,pdf
,1993 - Official Statement,Investor Relations - Library,pdf
,1993 - Partial Redemption,Investor Relations - Library,pdf
,1997-A-B-C - Official Statement,Investor Relations - Library,pdf
,1997-A-B-C- Original Indenture,Investor Relations - Library,pdf
,1997-D - Official Statement,Investor Relations - Library,pdf
,1997-D- 1st Supplement,Investor Relations - Library,pdf
,1999-A- 2nd Supplement,Investor Relations - Library,pdf
,2001-A- 3rd Supplement,Investor Relations - Library,pdf
,2001-A Official Statement,Investor Relations - Library,pdf
,2001-B - Official Statement,Investor Relations - Library,pdf
,2002-A - Official Statement,Investor Relations - Library,pdf
,2002-A- 4th Supplement,Investor Relations - Library,pdf
,2002-B - Official Statement,Investor Relations - Library,pdf
,2002-C - Escrow Trust Agreement,Investor Relations - Library,pdf
,2002-C - Official Statement,Investor Relations - Library,pdf
,2002-C- 6th Supplement,Investor Relations - Library,pdf
,2002-D - Official Statement,Investor Relations - Library,pdf
,2002-D- 7th Supplement,Investor Relations - Library,pdf
,2003-A - Official Statement,Investor Relations - Library,pdf
,2003-B - Escrow Trust Agreement,Investor Relations - Library,pdf
,2003-B - Official Statement,Investor Relations - Library,pdf
,2003-B- 9th Supplement,Investor Relations - Library,pdf
,2003-C - Official Statement,Investor Relations - Library,pdf
,2003-C - Trust Escrow Agreement,Investor Relations - Library,pdf
,2003-C- 10th Supplement,Investor Relations - Library,pdf
,2003-C- 8th Supplement,Investor Relations - Library,pdf
,2004-A - Capital Improvement,Investor Relations - Library,pdf
,2004-A Educational Sales Tax: Limited Obligation School Tax Litigation Update - 09/01/06,Investor Relations - Library,pdf
06/30/2014,2004-A Original Indenture School Warrants,Investor Relations - Library,pdf
06/30/2014,2005-A & B - Education Warrants: 2005-A & B - Official Statement - Education Warrants,Investor Relations - Library,pdf
,2005-A & B - Education Warrants: Certificate of Trustee - Limited Obligation School Warrants - 10/12/06,Investor Relations - Library,pdf
,2005-A & B - Education Warrants: No-Litigation Certificate - Limited Obligation School Warrants - 10/12/06,Investor Relations - Library,pdf
,2005-A & B - Education Warrants: Supreme Court Opinion - Warrant Issue/Related Tax Levy - 08/16/06,Investor Relations - Library,pdf
,2005-A & B- 1st Supplemental Indenture School Warrants,Investor Relations - Library,pdf
,"2006 - Official Statement - Lease Revenue Warrants - $86,745,000",Investor Relations - Library,pdf
,2006 - Official Statement - Second Supplemental - Lease Revenue Warrants,Investor Relations - Library,pdf
,2006 - Official Statement - Supplement - Lease Revenue Warrants,Investor Relations - Library,pdf
,Audit - Corrected Page (25) (2003),Investor Relations - Library,pdf
,Bond Call & Defeasance - 1997-A (2003-B),Investor Relations - Library,pdf
,Bond Call & Defeasance - 1997-A (2003-C),Investor Relations - Library,pdf
,Bond Call & Defeasance - 1997-D,Investor Relations - Library,pdf
,Bond Call & Defeasance - 1997-D (2003-B),Investor Relations - Library,pdf
,Bond Call & Defeasance - 1997-D (2003-C),Investor Relations - Library,pdf
,Bond Call & Defeasance - 1999-A,Investor Relations - Library,pdf
,Bond Call & Defeasance - 1999-A (2003-B),Investor Relations - Library,pdf
,Bond Call & Defeasance - 1999-A (2003-C),Investor Relations - Library,pdf
,Bond Call & Defeasance - 2001-A,Investor Relations - Library,pdf
,Bond Call & Defeasance - 2001-A (2003-B),Investor Relations - Library,pdf
,Bond Call & Defeasance - 2001-A (2003-C),Investor Relations - Library,pdf
,Bond Call & Defeasance - 2002-D (2003-B),Investor Relations - Library,pdf
,Bond Call & Defeasance - 2002-D (2003-C),Investor Relations - Library,pdf
,Commission 2006 Resolution of Organization,Investor Relations - Library,pdf
,Defeasance Opinion,Investor Relations - Library,pdf
09/30/2006,Fiscal Year Ending - 2006b,Investor Relations - Library,pdf
09/30/2007,Fiscal Year Ending - 2007b,Investor Relations - Library,pdf
09/30/2008,Fiscal Year Ending - 2008b,Investor Relations - Library,pdf
09/30/2009,Fiscal Year Ending - 2009b,Investor Relations - Library,pdf
09/30/2010,Fiscal Year Ending - 2010b,Investor Relations - Library,pdf
,Mandatory Tender Notice - 2002-C-5,Investor Relations - Library,pdf
,Mandatory Tender Notice - 2002-C-5,Investor Relations - Library,pdf
,Material Event Notice - 1997-A - Bond Call & Defeasance,Investor Relations - Library,pdf
,Material Event Notice - 1997-D - Bond Call & Defeasance,Investor Relations - Library,pdf
,Material Event Notice - 1999-A - Bond Call & Defeasance,Investor Relations - Library,pdf
,Material Event Notice - 2001-A - Bond Call & Defeasance,Investor Relations - Library,pdf
,Material Event Notice - 2002-D - Bond Call & Defeasance,Investor Relations - Library,pdf
,Notice of Partial Refunding - 1997-A,Investor Relations - Library,pdf
,Notice of Partial Refunding - 1997-A (2003-B) (Final),Investor Relations - Library,pdf
,Notice of Partial Refunding - 1997-A (2003-C)(Final),Investor Relations - Library,pdf
,Notice of Partial Refunding - 1997-D,Investor Relations - Library,pdf
,Notice of Partial Refunding - 1997-D (2003-B)(Final),Investor Relations - Library,pdf
,Notice of Partial Refunding - 1997-D (2003-C)(Final),Investor Relations - Library,pdf
,Notice of Partial Refunding - 1997-D (Final),Investor Relations - Library,pdf
,Notice of Partial Refunding - 1999-A,Investor Relations - Library,pdf
,Notice of Partial Refunding - 1999-A (2003-B) (Final),Investor Relations - Library,pdf
,Notice of Partial Refunding - 1999-A (Final),Investor Relations - Library,pdf
,Notice of Partial Refunding - 2001-A,Investor Relations - Library,pdf
,Notice of Partial Refunding - 2001-A (2003-B)(Final),Investor Relations - Library,pdf
,Notice of Partial Refunding - 2001-A (2003-C)(Final),Investor Relations - Library,pdf
,Notice of Partial Refunding - 2001-A (Final),Investor Relations - Library,pdf
,Notice of Partial Refunding - 2002-D,Investor Relations - Library,pdf
,Notice of Partial Refunding - 2002-D (2003-B)(Final),Investor Relations - Library,pdf
,Notice of Partial Refunding - 2002-D (2003-C)(Final),Investor Relations - Library,pdf
,Reoffering Circular - 2002-C-5,Investor Relations - Library,pdf
,Resolution - SRF Warrant 1997-C,Investor Relations - Library,pdf
,SEC RULE 15c2-12 FILINGS,Investor Relations - Library,pdf
04/02/2013,April 02 - 2013 - Material Event Notice - General Obligation Warrants,Investor Relations - Men,pdf
04/06/2012,April 06 - 2012 - Material Event Notice - General Obligation Warrants,Investor Relations - Men,pdf
04/06/2012,April 06 - 2012 - Material Event Notice - Public Building Authority,Investor Relations - Men,pdf
04/06/2012,April 06 - 2012 - Material Event Notice - Sewer Revenue Warrants,Investor Relations - Men,pdf
08/23/2012,August 23 - 2012 - Material Event Notice - Public Building Authority,Investor Relations - Men,pdf
02/01/2013,February 01 - 2013 - Material Event Notice - Sewer Revenue Warrants,Investor Relations - Men,pdf
02/07/2012,February 07 - 2012 - Material Event Notice,Investor Relations - Men,pdf
02/07/2012,February 07 - 2012 - Material Event Notice - Sewer Revenue Warrants,Investor Relations - Men,pdf
02/13/2012,February 13 - 2012 - Material Event Notice - Sewer Revenue Warrants,Investor Relations - Men,pdf
02/15/2013,February 15 - 2013 - Material Event Notice - Limited Obligation School Warrants,Investor Relations - Men,pdf
02/15/2013,February 15 - 2013 - Material Event Notice - Sewer Revenue Warrants,Investor Relations - Men,pdf
01/05/2012,January 05 - 2012 - Material Event Notice - Sewer Revenue Warrants,Investor Relations - Men,pdf
01/17/2013,January 17 - 2013 - Material Event Notice - Public Building Authority,Investor Relations - Men,pdf
01/25/2013,January 25 - 2013 - Material Event Notice - Sewer Revenue Warrants,Investor Relations - Men,pdf
07/09/2012,July 09 - 2012 - Material Event Notice - Sewer Revenue Warrants,Investor Relations - Men,pdf
07/01/2013,"July 1, 2013 - Material Event Notice - Bankruptcy Plan",Investor Relations - Men,pdf
07/01/2013,"July 1, 2013 - Material Event Notice - Sewer Revenue Warrants",Investor Relations - Men,pdf
07/29/2013,"July 29, 2013 - Material Event Notice - Lease Revenue Warrants",Investor Relations - Men,pdf
07/30/2013,"July 30, 2013 - Material Event Notice - Bankruptcy Plan",Investor Relations - Men,pdf
07/27/2013,"June 27, 2013 - Material Event Notice - Bankruptcy",Investor Relations - Men,pdf
06/04/2013,June 4 - 2013 - Material Event Notice - Sewer Revenue Warrants,Investor Relations - Men,pdf
04/20/2009,"Liquidity Facility Forbearance - April 20, 2009",Investor Relations - Men,pdf
08/18/2009,"Liquidity Facility Forbearance - August 18, 2009",Investor Relations - Men,pdf
12/05/2008,"Liquidity Facility Forbearance - December 5, 2008",Investor Relations - Men,pdf
03/12/2009,"Liquidity Facility Forbearance - GO Warrants - March 12, 2009",Investor Relations - Men,pdf
06/30/2009,"Liquidity Facility Forbearance - June 30, 2009",Investor Relations - Men,pdf
10/01/2008,"Liquidity Facility Forbearance - October 1, 2008",Investor Relations - Men,pdf
10/30/2008,"Liquidity Facility Forbearance - October 30, 2008",Investor Relations - Men,pdf
10/07/2008,"Liquidity Facility Forbearance - October 7, 2008",Investor Relations - Men,pdf
01/15/2009,"Liquidity Facility Forbearance (GO Warrants) - January 15, 2009",Investor Relations - Men,pdf
02/20/2009,"Liquidity Forbearance - February 20, 2009",Investor Relations - Men,pdf
03/06/2013,March 06 - 2013 - Material Event Notice - General Obligation Warrants,Investor Relations - Men,pdf
03/30/2012,March 30 - 2012 - Material Event Notice - General Obligation Warrants,Investor Relations - Men,pdf
03/30/2012,March 30 - 2012 - Material Event Notice - Public Building Authority,Investor Relations - Men,pdf
11/09/2011,"Material Event Notice - All Warrants - November 9, 2011",Investor Relations - Men,pdf
09/16/2011,"Material Event Notice - All Warrants - Sept 16, 2011",Investor Relations - Men,pdf
03/28/2008,"Material Event Notice - Annual Report for Fiscal Period 2007 - March 28, 2008",Investor Relations - Men,pdf
04/15/2008,"Material Event Notice - First Amendment Swap Forbearance - April 15, 2008",Investor Relations - Men,pdf
04/15/2008,"Material Event Notice - First Amendment to Standby Purchase Forbearance Agreement - April 15, 2008",Investor Relations - Men,pdf
08/01/2008,"Material Event Notice - GO Warrants - August 1, 2008",Investor Relations - Men,pdf
08/24/2009,"Material Event Notice - GO Warrants - August 24, 2009",Investor Relations - Men,pdf
12/01/2011,"Material Event Notice - GO Warrants - December 1, 2011",Investor Relations - Men,pdf
12/13/2010,"Material Event Notice - GO Warrants - December 13, 2010",Investor Relations - Men,pdf
12/08/2008,"Material Event Notice - GO Warrants - December 8, 2008",Investor Relations - Men,pdf
01/15/2009,"Material Event Notice - GO Warrants - January 15, 2009",Investor Relations - Men,pdf
07/20/2009,"Material Event Notice - GO Warrants - July 20, 2009",Investor Relations - Men,pdf
06/30/2008,"Material Event Notice - GO Warrants - June 30, 2008",Investor Relations - Men,pdf
06/09/2008,"Material Event Notice - GO Warrants - June 9, 2008",Investor Relations - Men,pdf
03/17/2009,"Material Event Notice - GO Warrants - March 17, 2009",Investor Relations - Men,pdf
03/29/2011,"Material Event Notice - GO Warrants - March 29, 2011",Investor Relations - Men,pdf
03/31/2010,"Material Event Notice - GO Warrants - March 31, 2010",Investor Relations - Men,pdf
05/04/2009,"Material Event Notice - GO Warrants - May 4, 2009",Investor Relations - Men,pdf
11/10/2008,"Material Event Notice - GO Warrants - November 10, 2008",Investor Relations - Men,pdf
10/06/2008,"Material Event Notice - GO Warrants - October 6, 2008",Investor Relations - Men,pdf
10/09/2008,"Material Event Notice - GO Warrants - October 9, 2008",Investor Relations - Men,pdf
09/22/2008,"Material Event Notice - GO Warrants - September 22, 2008",Investor Relations - Men,pdf
09/29/2008,"Material Event Notice - GO Warrants - September 29, 2008",Investor Relations - Men,pdf
09/29/2010,"Material Event Notice - GO Warrants - September 29, 2010",Investor Relations - Men,pdf
09/08/2008,"Material Event Notice - GO Warrants - September 8, 2008",Investor Relations - Men,pdf
11/10/2008,"Material Event Notice - GO Warrants (Ratings) - November 10, 2008",Investor Relations - Men,pdf
03/04/2008,"Material Event Notice - GO Warrants 2001-A - March 4, 2008",Investor Relations - Men,pdf
07/15/2010,"Material Event Notice - GO Warrants Notice - July 15, 2010",Investor Relations - Men,pdf
03/31/2008,"Material Event Notice - GO Warrants Notice - March 31, 2008",Investor Relations - Men,pdf
,Material Event Notice - Jefferson County Annual Report - 2008,Investor Relations - Men,pdf
08/29/2008,"Material Event Notice - Liquidity Facility Forbearance - August 29, 2008",Investor Relations - Men,pdf
05/30/2008,"Material Event Notice - Liquidity Facility Forbearance - May 30, 2008",Investor Relations - Men,pdf
09/15/2008,"Material Event Notice - Liquidity Facility Forbearance - September 15, 2008",Investor Relations - Men,pdf
07/31/2008,"Material Event Notice - Liquidity Facility Forbearance -July 31, 2008",Investor Relations - Men,pdf
06/26/2007,"Material Event Notice - Moody's Opinion - June 26, 2007",Investor Relations - Men,pdf
09/08/2008,"Material Event Notice - Pub Bldg Auth - September 8, 2008",Investor Relations - Men,pdf
12/08/2008,"Material Event Notice - Pub Bldg Authority - December 8, 2008",Investor Relations - Men,pdf
08/24/2009,"Material Event Notice - Pub Building Authority - August 24, 2009",Investor Relations - Men,pdf
07/20/2009,"Material Event Notice - Pub Building Authority - July 20, 2009",Investor Relations - Men,pdf
05/04/2009,"Material Event Notice - Pub Building Authority - May 4, 2009",Investor Relations - Men,pdf
03/11/2008,"Material Event Notice - Pub. Building Auth. Notice - March 11, 2008",Investor Relations - Men,pdf
03/31/2008,"Material Event Notice - Pub. Building Auth. Notice - March 31, 2008",Investor Relations - Men,pdf
08/01/2008,"Material Event Notice - Public Bldg Authority - August 1, 2008",Investor Relations - Men,pdf
06/30/2008,"Material Event Notice - Public Bldg Authority - June 30, 2008",Investor Relations - Men,pdf
06/09/2008,"Material Event Notice - Public Bldg Authority - June 9, 2008",Investor Relations - Men,pdf
09/29/2008,"Material Event Notice - Public Bldg Authority - September 29, 2008",Investor Relations - Men,pdf
04/13/2011,"Material Event Notice - Public Building Authority - April 13, 2011",Investor Relations - Men,pdf
12/13/2010,"Material Event Notice - Public Building Authority - December 13, 2010",Investor Relations - Men,pdf
03/29/2011,"Material Event Notice - Public Building Authority - March 29, 2011",Investor Relations - Men,pdf
03/31/2010,"Material Event Notice - Public Building Authority - March 31, 2010",Investor Relations - Men,pdf
11/10/2008,"Material Event Notice - Public Building Authority - November 10, 2008",Investor Relations - Men,pdf
02/28/2007,"Material Event Notice - School Revenue Warrants - February 28, 2007",Investor Relations - Men,pdf
04/13/2011,"Material Event Notice - School Warrants - April 13, 2011",Investor Relations - Men,pdf
04/27/2011,"Material Event Notice - School Warrants - April 27, 2011",Investor Relations - Men,pdf
08/24/2009,"Material Event Notice - School Warrants - August 24, 2009",Investor Relations - Men,pdf
12/13/2010,"Material Event Notice - School Warrants - December 13, 2010",Investor Relations - Men,pdf
12/08/2008,"Material Event Notice - School Warrants - December 8, 2008",Investor Relations - Men,pdf
02/04/2010,"Material Event Notice - School Warrants - February 4, 2010",Investor Relations - Men,pdf
07/20/2009,"Material Event Notice - School Warrants - July 20, 2009",Investor Relations - Men,pdf
06/30/2008,"Material Event Notice - School Warrants - June 30, 2008",Investor Relations - Men,pdf
06/09/2008,"Material Event Notice - School Warrants - June 9, 2008",Investor Relations - Men,pdf
03/31/2010,"Material Event Notice - School Warrants - March 31, 2010",Investor Relations - Men,pdf
05/04/2009,"Material Event Notice - School Warrants - May 4, 2009",Investor Relations - Men,pdf
10/10/2008,"Material Event Notice - School Warrants - November 10, 2008",Investor Relations - Men,pdf
09/29/2008,"Material Event Notice - School Warrants - September 29, 2008",Investor Relations - Men,pdf
09/08/2008,"Material Event Notice - School Warrants - September 8, 2008",Investor Relations - Men,pdf
08/01/2008,"Material Event Notice - School Warrants Notice - August 1, 2008",Investor Relations - Men,pdf
03/11/2008,"Material Event Notice - School Warrants Notice - March 11, 2008",Investor Relations - Men,pdf
03/31/2008,"Material Event Notice - School Warrants Notice - March 31, 2008",Investor Relations - Men,pdf
04/01/2008,"Material Event Notice - Sewer Notice - April 1, 2008",Investor Relations - Men,pdf
03/11/2008,"Material Event Notice - Sewer Notice - March 11, 2008",Investor Relations - Men,pdf
03/31/2008,"Material Event Notice - Sewer Notice - March 31, 2008",Investor Relations - Men,pdf
03/04/2008,"Material Event Notice - Sewer Revenue - March 4, 2008",Investor Relations - Men,pdf
10/28/2008,"Material Event Notice - Sewer Revenue Warrant - October 28, 2008",Investor Relations - Men,pdf
04/06/2009,"Material Event Notice - Sewer Revenue Warrants - April 6, 2009",Investor Relations - Men,pdf
08/13/2008,"Material Event Notice - Sewer Revenue Warrants - August 13, 2008",Investor Relations - Men,pdf
08/24/2009,"Material Event Notice - Sewer Revenue Warrants - August 24, 2009",Investor Relations - Men,pdf
12/19/2008,"Material Event Notice - Sewer Revenue Warrants - December 19, 2008",Investor Relations - Men,pdf
12/08/2008,"Material Event Notice - Sewer Revenue Warrants - December 8, 2008",Investor Relations - Men,pdf
02/20/2008,"Material Event Notice - Sewer Revenue Warrants - February 20, 2008",Investor Relations - Men,pdf
02/24/2009,"Material Event Notice - Sewer Revenue Warrants - February 24, 2009",Investor Relations - Men,pdf
02/27/2008,"Material Event Notice - Sewer Revenue Warrants - February 27, 2008",Investor Relations - Men,pdf
01/05/2009,"Material Event Notice - Sewer Revenue Warrants - January 5, 2009",Investor Relations - Men,pdf
07/19/2011,"Material Event Notice - Sewer Revenue Warrants - July 19, 2011",Investor Relations - Men,pdf
07/06/2009,"Material Event Notice - Sewer Revenue Warrants - July 6, 2009",Investor Relations - Men,pdf
06/02/2008,"Material Event Notice - Sewer Revenue Warrants - June 2, 2008",Investor Relations - Men,pdf
06/03/2011,"Material Event Notice - Sewer Revenue Warrants - June 3, 2011",Investor Relations - Men,pdf
06/30/2008,"Material Event Notice - Sewer Revenue Warrants - June 30, 2008",Investor Relations - Men,pdf
06/09/2008,"Material Event Notice - Sewer Revenue Warrants - June 9, 2008",Investor Relations - Men,pdf
03/03/2010,"Material Event Notice - Sewer Revenue Warrants - March 3, 2010",Investor Relations - Men,pdf
