Guyyaa,Maal,Link
Mar 29,Outdoor BBQ and Fund Calanqoo Soccer Team of Arizona; Time: 3:00PM,"Place: 2605 North 15th Avenue Phoenix AZ, and Encantto Blvd"
Apr 4,"Folle Entertainment Presents Spring Concert - Live in DC; Time: 9:00PM - 2:00AM, 16+ to Party","Location: 1000 U Street, NW, Washington, DC 20001"
Apr 4-5,"Yaadannoo Goototaa; Sagantaan Bashannanaa, Sanbata -Sa'aa 8:00WB irraa eegala; Walagahii Hawaasaa Dilbata - Sa'aa 2:00 PM irraa eegala","Bakki: Temple Community Association, 167 Temple Green Road, NE, T1Y6G3 Calgary, AB"
Apr 11,"International Qeerroo Suupport Group (IQSG)/Dhaabbata Deeggarsa Eeerroo Idila Addunyaa, SaвЂ™a: 5:00PM EST","Bakka: Washington Ethical Society, 7750 16th St. NW, Washington, DC 20012"
Apr 11,"Waamicha Kabajaa Guyyaa Goototaa Oromoo Magaalaa Torontoo, Sa'aa 2:00 WB","Bakki: Waltajii Hawaasa Oromoo Torontoo, 94A Kenhar Drive Drive North York, Ontario"
Apr 12,"Waamicha Guyya Goototaa kan bara 2015, Viiktooriyaa, Awustraliyaa; Sa'aa 2:00 WB (PM)",Guyyaa Goototaa (2015) - in Youtube Video
Apr 18-19,WAAMICHA KORA XIQQOO ABO: KUTAA ISKANDANAAVIYAA BARA 2015: Ebla/April 18-19,Bakka: MAGAALAA OSLOOTTTI (address tbd)
