,An O-4 in the Coast Guard is equivilant to what in the.... 1. Army 2. Navy 3. Marine Corp 4. Air Force,1. Major 2. Lieutenant Commander 3. Major 4. Major
,An O-5 in the Coast Guard is equivilant to what in the.... 1. Army 2. Navy 3. Marine Corp 4. Air Force,1. Lieutenant Colonel 2. Commander 3. Lieutenant Colonel 4. Lieutenant Colonel
,An O-6 in the Coast Guard is equivilant to what in the.... 1. Army 2. Navy 3. Marine Corp 4. Air Force,1. Colonel 2. Captain 3. Colonel 4. Colonel
,An O-7 in the Coast Guard is equivilant to what in the.... 1. Army 2. Navy 3. Marine Corp 4. Air Force,1. Brigadier General 2. Rear Admiral Lower Half 3. Brigadier General 4. Brigadier General
,An O-8 in the Coast Guard is equivilant to what in the.... 1. Army 2. Navy 3. Marine Corp 4. Air Force,1. Major General 2. Rear Admiral Upper Half 3. Major General 4. Major General
,An O-9 in the Coast Guard is equivilant to what in the.... 1. Army 2. Navy 3. Marine Corp 4. Air Force,1. Lieutenant General 2. Vice Admrial 3. Lieutenant General 4. Lieutenant General
,An O-10 in the Coast Guard is equivilant to what in the.... 1. Army 2. Navy 3. Marine Corp 4. Air Force,1. General 2. Admrial 3. General 4. General
,What service does not have a 5 star officer?,Marine Corp
,What year did the rate of Petty Officer become official?,1808
,What year was the Chief Petty Officer rate established?,1893
,During what war did the Coast Guard rates become the same as those in the Navy?,World War I
,What is UCMJ article 91?,Insubordinate Conduct Toward an Officer
,What is UCMJ article 7?,Apprehension
,What is UCMJ Article 92?,Failure to Obey Order or Regulation
,What gives the Coast Guard its law enforcement authority and establishes who may exercise that authority?,14 USC 89
,"According to 14 USC 89, Petty Officers have the authority to do what?",Search Examine Arrest Seize Inspect Inquire (remember S.E.A.S.I.I.)
,Where is the Coast Guard Academy located?,"New London, Connecticut"
,An O-1 in the Coast Guard is equivilant to what in the.... 1. Army 2. Navy 3. Marine Corp 4. Air Force,1. 2nd Lieutenant 2. Ensign 3. 2nd Lieutenant 4. 2nd Lieutenant
,An O-2 in the Coast Guard is equivilant to what in the.... 1. Army 2. Navy 3. Marine Corp 4. Air Force,1. 1st Lieutenant 2. Ensign 3. 1st Lieutenant 4. 1st Lieutenant
,An O-3 in the Coast Guard is equivilant to what in the.... 1. Army 2. Navy 3. Marine Corp 4. Air Force,1. Captain 2. Lieutenant 3. Captain 4. Captain
,An O-4 in the Coast Guard is equivilant to what in the.... 1. Army 2. Navy 3. Marine Corp 4. Air Force,1. Major 2. Lieutenant Commander 3. Major 4. Major
,An O-5 in the Coast Guard is equivilant to what in the.... 1. Army 2. Navy 3. Marine Corp 4. Air Force,1. Lieutenant Colonel 2. Commander 3. Lieutenant Colonel 4. Lieutenant Colonel
,An O-6 in the Coast Guard is equivilant to what in the.... 1. Army 2. Navy 3. Marine Corp 4. Air Force,1. Colonel 2. Captain 3. Colonel 4. Colonel
,An O-7 in the Coast Guard is equivilant to what in the.... 1. Army 2. Navy 3. Marine Corp 4. Air Force,1. Brigadier General 2. Rear Admiral Lower Half 3. Brigadier General 4. Brigadier General
,An O-8 in the Coast Guard is equivilant to what in the.... 1. Army 2. Navy 3. Marine Corp 4. Air Force,1. Major General 2. Rear Admiral Upper Half 3. Major General 4. Major General
,An O-9 in the Coast Guard is equivilant to what in the.... 1. Army 2. Navy 3. Marine Corp 4. Air Force,1. Lieutenant General 2. Vice Admrial 3. Lieutenant General 4. Lieutenant General
,An O-10 in the Coast Guard is equivilant to what in the.... 1. Army 2. Navy 3. Marine Corp 4. Air Force,1. General 2. Admrial 3. General 4. General
,True or False You may attend political meetings in uniform.,False
,EMI is a form of punishment. True or False?,False
,What UCMJ article gives you the right to remain silent during a courts-martial?,Article 31
,What article gives Commanding officers the ability to impose NJP?,UCMJ Article 15
,An NJP appeal must be submitted within how many calander days?,5 days
