Title,Updated,Last By,Comments
Messianic Jews say they are persecuted in Israel (Jun '08),Jul 22,dGo mneDad lyHo i...,"71,943"
Del Rey Oaks Garden Center grand opening schedu...,Jul 21,Kathi Buckley Smith,1
drugs,Jul 16,JayJay,2
Sex offender Tom Pollacci pleads not guilty to ... (Mar '09),Jul 15,martin5,360
City of seaside needs to replace more than PD T...,Jul 10,fed up,1
Monterey Seafood Restaurant Celebrates its 26 Y...,Jul 6,cafefina58,1
Carmel waste broker accused of bribery (Dec '08),Jun 30,ChaCha,17
