Getting Started with Expression Web,
Creating a Web Site,
Adding Text and Links,
Structuring and Styling Text,
Working with Pictures,
Enhancing a Design with CSS,
Designing Site Navigation,
Testing and Publishing Your Web Site,
Working with Tables,
Working with Forms,
Working with Behaviors and Multimedia,
Using Code Tools,
Advanced Typography Using CSS,
Creating a Layout with CSS,
Designing Like a Pro,
Working with Dynamic Web Templates,
Table of Contents provided by Publisher. All Rights Reserved.,
